"id:ID","uri","label","extensible","notation","definition","identifier","alt_label","pref_label"
"38227","http://id.d4k.dk/dataset/cdisc/ct/v48/protocol/C127259-C127779","","","CASE CROSSOVER","A study in which the subject characteristics of the case, immediately prior to disease onset (sometimes called the hazard period), are compared to characteristics of same case at a prior time (i.e., control period). (ClinicalTrials.gov)","C127779","","Observational Case-Crossover Study"
"38228","http://id.d4k.dk/dataset/cdisc/ct/v48/protocol/C127259-C15362","","","CASE ONLY","A study in which the subject with the condition under study (the case) is compared against a theoretical/historical model of distribution that serves as a control.","C15362","","Case Study"
"38229","http://id.d4k.dk/dataset/cdisc/ct/v48/protocol/C127259-C15208","","","COHORT","A study in which subjects are grouped based on a predefined personal or administrative characteristic.","C15208","","Cohort Study"
"38230","http://id.d4k.dk/dataset/cdisc/ct/v48/protocol/C127259-C127780","","","ECOLOGIC OR COMMUNITY","A study in which geographically distinct study populations are compared with respect to a particular outcome.","C127780","","Ecologic or Community Based Study"
"38231","http://id.d4k.dk/dataset/cdisc/ct/v48/protocol/C127259-C15407","","","FAMILY BASED","A study in which related or non-related family members are compared with respect to a particular outcome.","C15407","","Family Study"
"38232","http://id.d4k.dk/dataset/cdisc/ct/v48/protocol/C165641","Outcome Measure Attribute Terminology","False","Outcome Measure Attribute Terminology","A terminology value set relevant to the attributes of the outcome measure entity.","C165641","Outcome Measure Attribute Terminology","CDISC Protocol Outcome Measure Attribute Terminology"
"38233","http://id.d4k.dk/dataset/cdisc/ct/v48/protocol/C165641-C165138","","","Outcome Measure Description","A full description of the outcome measure.","C165138","","Study Outcome Measure Description"
"38234","http://id.d4k.dk/dataset/cdisc/ct/v48/protocol/C165641-C165859","","","Outcome Measure Time Frame","The period of time over which the study outcome measure is assessed.","C165859","","Outcome Measure Time Frame"
"38235","http://id.d4k.dk/dataset/cdisc/ct/v48/protocol/C165641-C165860","","","Outcome Measure Title","The descriptive name of the outcome measure.","C165860","","Outcome Measure Title"
"38236","http://id.d4k.dk/dataset/cdisc/ct/v48/protocol/C165641-C165861","","","Outcome Measure Type","A characterization or classification of the specific key measurement(s) or observation(s) used to measure the effect of experimental variables on the participants in a study, or for observational studies, to describe patterns of diseases or traits or associations with exposures, risk factors or treatment.","C165861","","Outcome Measure Type"
"38237","http://id.d4k.dk/dataset/cdisc/ct/v48/protocol/C170442","Outcome Measure Type Value Set Terminology","False","Outcome Measure Type Value Set Terminology","The terminology relevant to the type of outcome measure for the study.","C170442","Outcome Measure Type Value Set Terminology","CDISC Protocol Outcome Measure Type Value Set Terminology"
"38238","http://id.d4k.dk/dataset/cdisc/ct/v48/protocol/C170442-C98724","","","Exploratory Outcome Measure","The outcome measure(s) that is part of a pre-specified analysis plan used to evaluate the exploratory endpoint(s) associated with exploratory study objective(s) and/or any other measures, excluding post-hoc measures, that are a focus of the study. (After clinicaltrials.gov)","C98724","Exploratory Outcome Measure","Exploratory Outcome Measure"
"38239","http://id.d4k.dk/dataset/cdisc/ct/v48/protocol/C170442-C98772","","","Primary Outcome Measure","The outcome measure(s) of greatest importance specified in the protocol, usually the one(s) used in the power calculation, to evaluate the primary endpoint(s) associated with the primary study objective(s). (After Clinicaltrials.gov)","C98772","Primary Outcome Measure","Primary Outcome Measure"
"38240","http://id.d4k.dk/dataset/cdisc/ct/v48/protocol/C170442-C98781","","","Secondary Outcome Measure","The outcome measure(s) that is part of a pre-specified analysis plan used to evaluate the secondary endpoint(s) associated with secondary study objective(s) and/or used to evaluate any measure(s) ancillary to the primary or secondary endpoint(s). (After Clinicaltrials.gov).","C98781","Secondary Outcome Measure","Secondary Outcome Measure"
"38241","http://id.d4k.dk/dataset/cdisc/ct/v48/protocol/C165642","Oversight Entity Value Set","False","Oversight Entity Value Set","The terminology relevant to the type of oversight entity for the study.","C165642","Oversight Entity Value Set","CDISC Protocol Oversight Entity Value Set Terminology"
"38242","http://id.d4k.dk/dataset/cdisc/ct/v48/protocol/C165642-C142489","","","Data Monitoring Committee","A group of independent experts who are appointed to monitor the safety and scientific integrity of a research intervention, protect the confidentiality of participant data, and to make recommendations to the sponsor regarding the stopping of the trial for safety, efficacy, or for futility. (clinicaltrials.gov)","C142489","Data and Safety Monitoring Board;Data and Safety Monitoring Committee DSMB;Data Monitoring and Oversight Committee;DMC;DMOC;DSMC;IDMC;Independent Data Monitoring Committee","Data Monitoring Committee"
"38243","http://id.d4k.dk/dataset/cdisc/ct/v48/protocol/C165642-C142579","","","Independent Ethics Committee","An independent body (a review board or a committee, institutional, regional, national, or supranational), constituted of medical professionals and non-medical members, whose responsibility it is to ensure the protection of the rights, safety and well-being of human subjects involved in a study and to provide public assurance of that protection, by, among other things, reviewing and approving/providing favorable opinion on, the study protocol, the suitability of the investigator(s), facilities, and the methods and material to be used in obtaining and documenting informed consent of the study subjects. The legal status, composition, function, operations and regulatory requirements pertaining to Independent Ethics Committees may differ among countries, but should allow the Independent Ethics Committee to act in agreement with GCP as described in the ICH E6 guideline. (ICH E6 R2)","C142579","IEC","Independent Ethics Committee"
"38244","http://id.d4k.dk/dataset/cdisc/ct/v48/protocol/C165642-C165865","","","Independent Safety Monitor","An independent physician or health-care professional who evaluates individual and cumulative participant data to make recommendations regarding the safe continuation of the study. (NIH)","C165865","ISM","Independent Safety Monitor"
"38245","http://id.d4k.dk/dataset/cdisc/ct/v48/protocol/C165642-C16741","","","Institutional Review Board","An independent body constituted of medical, scientific, and non-scientific members, whose responsibility is to ensure the protection of the rights, safety and well-being of human subjects involved in a study by, among other things, reviewing, approving, and providing continuing review of study protocol and amendments and of the methods and material to be used in obtaining and documenting informed consent of the study subjects. (ICH E6 R2)","C16741","IRB","Institutional Review Board"
"38246","http://id.d4k.dk/dataset/cdisc/ct/v48/protocol/C165642-C165866","","","Observational Study Monitoring Committee","A group of independent experts who are appointed to monitor the safety and scientific integrity of an observational study, including protecting the confidentiality of participant data and to make recommendations regarding the stopping of the study for safety or for futility. (clinicaltrials.gov)","C165866","Observational Study Monitoring Board;OSMB;OSMC","Observational Study Monitoring Committee"
"38247","http://id.d4k.dk/dataset/cdisc/ct/v48/protocol/C165642-C165867","","","Safety Monitoring Committee","Group of individuals with pertinent expertise that reviews, on a regular basis, accumulating safety data from an ongoing clinical study. This independent committee monitors the safety of participants during the study.","C165867","Safety Assessment Committee;Safety Monitoring Board;SMC","Safety Monitoring Committee"
"38248","http://id.d4k.dk/dataset/cdisc/ct/v48/protocol/C147068","Participant Allocation Value Set","False","Participant Allocation Value Set","A terminology codelist for the method of assigning participants, or subjects, to groups or categories within a clinical study.","C147068","Participant Allocation Value Set","CDISC Protocol Subject Allocation Response Terminology"
"38249","http://id.d4k.dk/dataset/cdisc/ct/v48/protocol/C147068-C93043","","","Nonrandomized","Participants are expressly assigned to intervention groups through a non-random method. (clinicaltrials.gov)","C93043","","Nonrandomized Clinical Trial"
"38250","http://id.d4k.dk/dataset/cdisc/ct/v48/protocol/C147068-C48660","","","Not Applicable","Determination of a value is not relevant in the current context. (NCI)","C48660","NA;Not Applicable","Not Applicable"
"38251","http://id.d4k.dk/dataset/cdisc/ct/v48/protocol/C147068-C25196","","","Randomized","The process of assigning trial subjects to treatment or control groups using an element of chance to determine the assignments in order to reduce bias. NOTE: Unequal randomization is used to allocate subjects into groups at a differential rate; for example, three subjects may be assigned to a treatment group for every one assigned to the control group. [ICH E6 1.48] See also balanced study. (CDISC glossary)","C25196","Trial is Randomized","Randomization"
"38252","http://id.d4k.dk/dataset/cdisc/ct/v48/protocol/C132308","Physical Address Attribute Terminology","False","Physical Address Attribute Terminology","A terminology value set relevant to the attributes of the physical address entity.","C132308","Physical Address Attribute Terminology","CDISC Protocol Entities Physical Address Attribute Terminology"
"38253","http://id.d4k.dk/dataset/cdisc/ct/v48/protocol/C132308-C25160","","","City","A relatively large and/or densely populated area of human habitation with administrative or legal status that may be specified as a component of a postal address.","C25160","","City"
"38254","http://id.d4k.dk/dataset/cdisc/ct/v48/protocol/C132308-C25464","","","Country","A sovereign nation occupying a distinct territory and ruled by an autonomous government.","C25464","","Country"
"38255","http://id.d4k.dk/dataset/cdisc/ct/v48/protocol/C132308-C87189","","","Geographic Locality","A distinct geographic area in the immediate vicinity of a particular place, such as a city, neighborhood or district.","C87189","","Locality"
"38256","http://id.d4k.dk/dataset/cdisc/ct/v48/protocol/C132308-C16632","","","Geographic Region","Any demarcated area of the Earth; may be determined by both natural and human boundaries, such as a state or province.","C16632","","Geographic Area"
"38257","http://id.d4k.dk/dataset/cdisc/ct/v48/protocol/C132308-C25621","","","Postal Code","An alphanumeric code assigned to a mail delivery area.","C25621","","Postal Code"
"38258","http://id.d4k.dk/dataset/cdisc/ct/v48/protocol/C132308-C25632","","","Province","A sub-division of a country created by the central government for administrative purposes. Provinces are usually, but not always, less autonomous than states, and must obey the laws of the central government.","C25632","","Province"
"38259","http://id.d4k.dk/dataset/cdisc/ct/v48/protocol/C132308-C87194","","","State","A sub-division of a country that forms part of a federal union. States are usually, but not always, more autonomous than provinces and may have different laws from the central government.","C87194","","State"
"38260","http://id.d4k.dk/dataset/cdisc/ct/v48/protocol/C132308-C25690","","","Street Address","The street name and building number where an entity is located.","C25690","","Street Address"
"38261","http://id.d4k.dk/dataset/cdisc/ct/v48/protocol/C181167","Protocol Amendment Attribute Terminology","False","Protocol Amendment Attribute Terminology","A terminology value set relevant to the attributes of the protocol amendment.","C181167","Protocol Amendment Attribute Terminology","CDISC Protocol Amendment Attribute Terminology"
"38262","http://id.d4k.dk/dataset/cdisc/ct/v48/protocol/C181167-C181233","","","Brief Rationale for Protocol Change","A concise explanation justifying an individual change in the protocol.","C181233","Brief Rationale for Protocol Modification;Brief Rationale for Protocol Revision","Brief Rationale for Protocol Change"
"38263","http://id.d4k.dk/dataset/cdisc/ct/v48/protocol/C181167-C181234","","","Overall Rationale for Protocol Amendment","A summarized explanation justifying a protocol amendment.","C181234","Overall Justification for Amendment","Overall Rationale for Protocol Amendment"
"38264","http://id.d4k.dk/dataset/cdisc/ct/v48/protocol/C181167-C132352","","","Study Protocol Version Approval by Sponsor Date","The date on which a version of the protocol was finalized or approved by the sponsor.","C132352","Protocol Amendment Approval by Sponsor Date;Study Protocol Version Approval Date","Protocol Approval by Sponsor Date"
"38265","http://id.d4k.dk/dataset/cdisc/ct/v48/protocol/C181167-C181232","","","Study Protocol Version Number","A string of numerals that uniquely identifies a specific version of a study protocol.","C181232","Study Protocol Amendment Number","Study Protocol Version Number"
"38266","http://id.d4k.dk/dataset/cdisc/ct/v48/protocol/C154681","Protocol Contact Role Value Set","False","Protocol Contact Role Value Set","The terminology relevant to the role that the individual or entity plays with respect to being a contact within a study protocol.","C154681","Protocol Contact Role Value Set","CDISC Protocol Entities Protocol Contact Role Response Terminology"
"38267","http://id.d4k.dk/dataset/cdisc/ct/v48/protocol/C154681-C154709","","","Biostatistician","A person who is responsible for the statistical aspects of the clinical or pre-clinical study. (NCI)","C154709","","Biostatistician"
"38268","http://id.d4k.dk/dataset/cdisc/ct/v48/protocol/C154681-C154708","","","Clinical Informaticist","An individual that designs, implements, evaluates and/or analyzes information technology in a healthcare or research setting. (NCI)","C154708","Clinical Informatician","Clinical Informaticist"
"38269","http://id.d4k.dk/dataset/cdisc/ct/v48/protocol/C154681-C51811","","","Clinical Research Coordinator","A person to whom a clinical investigator delegates routine administrative requirements of a protocol. The duties and responsibilities of a clinical research coordinator may vary across different infrastructures. Generally, the coordinator manages the subject's clinical trial participation and provides a vital linkage between the subject, the investigator, and the sponsor. (NCI)","C51811","CRC","Clinical Coordinator"
"38270","http://id.d4k.dk/dataset/cdisc/ct/v48/protocol/C154681-C127526","","","Contact for Public Queries","The study contact person who is responsible for questions from the public.","C127526","","Public Queries Study Contact"
"38271","http://id.d4k.dk/dataset/cdisc/ct/v48/protocol/C154681-C51818","","","Coordinating Investigator","An investigator assigned the responsibility for the coordination of investigators at different centers participating in a multi-center trial. While a single-center study would not include a coordinating investigator, the investigator at the site would fulfill the same responsibilities as a principal investigator. (after ICH E6)","C51818","","Coordinating Investigator"
"38272","http://id.d4k.dk/dataset/cdisc/ct/v48/protocol/C154681-C51820","","","Data Manager","An individual who is responsible for the development and implementation of architectures, policies and procedures for the effective management of data across its business lifecycle.","C51820","","Data Manager"
"38273","http://id.d4k.dk/dataset/cdisc/ct/v48/protocol/C154681-C25936","","","Investigator","A person responsible for the conduct of the clinical trial at a trial site. If a trial is conducted by a team of individuals at the trial site, the investigator is the responsible leader of the team and may be called the principal investigator.","C25936","","Investigator"
"38274","http://id.d4k.dk/dataset/cdisc/ct/v48/protocol/C154681-C127532","","","Legal Representative for the Study","An individual with expertise in the law who provides legal counsel and representation for a study.","C127532","","Legal Representative for the Study"
"38275","http://id.d4k.dk/dataset/cdisc/ct/v48/protocol/C154681-C51836","","","Medical Monitor","A sponsor representative who has medical authority for the evaluation of the safety aspects of a clinical trial. (CDISC Glossary)","C51836","","Medical Monitor"
"38276","http://id.d4k.dk/dataset/cdisc/ct/v48/protocol/C154681-C154706","","","National Coordinating Investigator","In the case of a multinational study, a person who has the responsibilities of the sponsor of the study in his/her country and will be responsible for the coordination of the principal investigators at different sites within that member state. (EMA)","C154706","","National Coordinating Investigator"
"38277","http://id.d4k.dk/dataset/cdisc/ct/v48/protocol/C154681-C70794","","","Primary Sponsor","The individual, organization, group or other legal person taking responsibility for securing the arrangements to initiate and/or manage a study (including arrangements to ensure that the study design meets appropriate standards and to ensure appropriate conduct and reporting). In commercial trials, the primary sponsor is normally the main applicant for regulatory authorization to begin the study. It may or may not be the main funder. (NCI)","C70794","","Primary Clinical Study Sponsor"
"38278","http://id.d4k.dk/dataset/cdisc/ct/v48/protocol/C154681-C19924","","","Principal Investigator","A person who has the primary responsibility for the conduct of a clinical study and study-related personnel at a study site. While a single-center study would not include a coordinating investigator, the investigator at the site would fulfill the same responsibilities as a principal investigator.","C19924","","Principal Investigator"
"38279","http://id.d4k.dk/dataset/cdisc/ct/v48/protocol/C154681-C70795","","","Secondary Sponsor","Additional individuals, organizations or other legal persons, if any, that have agreed with the primary sponsor to take on responsibilities of sponsorship. A secondary sponsor may have agreed to take on all the responsibilities of sponsorship jointly with the primary sponsor; or to form a group with the primary sponsor in which the responsibilities of sponsorship are allocated among the members of the group; or to act as the sponsor's legal representative in relation to some or all of the study sites; or to take responsibility for the accuracy of study registration information submitted.","C70795","","Secondary Clinical Study Sponsor"
"38280","http://id.d4k.dk/dataset/cdisc/ct/v48/protocol/C154681-C70793","","","Sponsor","An entity that is responsible for the initiation, management, and/or financing of a clinical study.","C70793","Clinical Study Sponsor;Sponsor;Study Sponsor","Clinical Study Sponsor"
"38281","http://id.d4k.dk/dataset/cdisc/ct/v48/protocol/C154681-C51878","","","Study Chair","A person who has overall responsibility for the technical conduct of a study, as well as for the interpretation, analysis, documentation and reporting of results, and represents the single point of study control. (FDA)","C51878","Study Director","Study Chair"
"38282","http://id.d4k.dk/dataset/cdisc/ct/v48/protocol/C154681-C54622","","","Subinvestigator","Any member of the clinical trial team designated and supervised by the investigator at a trial site to perform critical trial-related procedures and/or to make important trial-related decisions (e.g., associates, residents, research fellows). (ICH)","C54622","","Subinvestigator"
"38283","http://id.d4k.dk/dataset/cdisc/ct/v48/protocol/C154681-C154707","","","Technical Lead","An individual who is responsible for the delivery of technical aspects of a project. (NCI)","C154707","","Technical Lead"
"38284","http://id.d4k.dk/dataset/cdisc/ct/v48/protocol/C132310","Protocol Entity Terminology","False","Protocol Entity Terminology","A terminology value set relevant to the entities within a protocol.","C132310","Protocol Entity Terminology","CDISC Protocol Entities Terminology"
"38285","http://id.d4k.dk/dataset/cdisc/ct/v48/protocol/C132310-C70699","","","Biological Sample","Any material collected from a biological entity for testing, diagnostic, propagation, treatment, or research purposes.","C70699","Biological Sample;Biological Specimen;Biospecimen;Sample","Biospecimen"
"38286","http://id.d4k.dk/dataset/cdisc/ct/v48/protocol/C132310-C15206","","","Clinical Study","A clinical study involves research using human volunteers (also called participants) that is intended to add to medical knowledge. There are two main types of clinical studies: clinical trials (also called interventional studies) and observational studies. [ClinicalTrials.gov] See also clinical trial. (CDISC Glossary)","C15206","","Clinical Study"
"38287","http://id.d4k.dk/dataset/cdisc/ct/v48/protocol/C132310-C71104","","","Clinical Trial","1) A research investigation involving human subjects that is designed to answer specific questions about the safety and efficacy of a biomedical intervention (drug, treatment, device) or new ways of using a known drug, treatment, or device). 2) A research study in which one or more human subjects are prospectively assigned to one or more interventions (which may include placebo or other control) to evaluate the effects of those interventions on health-related biomedical or behavioral outcomes.(1. modified from ICH E6 Glossary, Directive 2001/20/EC. 2. NIH revised definition 2015) (CDISC Glossary)","C71104","","Clinical Trial"
"38288","http://id.d4k.dk/dataset/cdisc/ct/v48/protocol/C132310-C25212","","","Endpoint","A defined variable intended to reflect an outcome measure of interest that is statistically analyzed to address a particular research question. NOTE: A precise definition of an endpoint typically specifies the type of assessments made, the timing of those assessments, the assessment tools used, and possibly other details, as applicable, such as how multiple assessments within an individual are to be combined. [After BEST Resource] (CDISC Glossary)","C25212","","End Point"
"38289","http://id.d4k.dk/dataset/cdisc/ct/v48/protocol/C132310-C16735","","","Informed Consent","Consent given by a subject, or in the case of an individual that can only give assent, by a parent or legal guardian, for the participation in a clinical study only after having achieved an understanding of both the relevant medical facts and the relevant risks involved.","C16735","","Informed Consent"
"38290","http://id.d4k.dk/dataset/cdisc/ct/v48/protocol/C132310-C51981","","","Ingredient","Any component that constitutes a part of a compound or mixture.","C51981","","Ingredient"
"38291","http://id.d4k.dk/dataset/cdisc/ct/v48/protocol/C132310-C25218","","","Intervention","The drug, device, therapy, or process under investigation in a clinical study that is believed to have an effect on outcomes of interest in a study. [After https://grants.nih.gov/grants/policy/faq_clinical_trial_definition.htm#5224] (CDISC-Glossary)","C25218","","Intervention or Procedure"
"38292","http://id.d4k.dk/dataset/cdisc/ct/v48/protocol/C132310-C93407","","","Outcome Measure","Specific key measurement(s) or observation(s) used to measure the effect of experimental variables on the participants in a study, or for observational studies, to describe patterns of diseases or traits or associations with exposures, risk factors or treatment. (BRIDG)","C93407","","Study Outcome Measurement"
"38293","http://id.d4k.dk/dataset/cdisc/ct/v48/protocol/C132310-C20200","","","Outcome","Events or experiences that clinicians or investigators examining the impact of an intervention or exposure measure because they believe such events or experiences may be influenced by the research intervention or exposure. Outcome is a general term in that it does not necessarily relate to a planned objective of the study. (FDA)","C20200","","Outcome"
"38294","http://id.d4k.dk/dataset/cdisc/ct/v48/protocol/C132310-C25407","","","Physical Address","A standardized representation of the location of a person, business, building, or organization. (NCI)","C25407","","Address"
"38295","http://id.d4k.dk/dataset/cdisc/ct/v48/protocol/C132310-C132347","","","Protocol Amendment","A written description of a change(s) to, or formal clarification of, a protocol. (ICH E6)","C132347","","Protocol Amendment"
"38296","http://id.d4k.dk/dataset/cdisc/ct/v48/protocol/C132310-C181183","","","Protocol Statement","A written message providing an official assurance, account, or assertion within the study protocol.","C181183","","Protocol Statement"
"38297","http://id.d4k.dk/dataset/cdisc/ct/v48/protocol/C132310-C15381","","","Quality Assurance","All those planned and systematic actions that are established to ensure that the study is performed and the data are generated, documented (recorded), and reported in compliance with good clinical practice (GCP) and the applicable regulatory requirement(s). (ICH)","C15381","QA","Quality Assurance"
"38298","http://id.d4k.dk/dataset/cdisc/ct/v48/protocol/C132310-C15311","","","Quality Control","The operational techniques and activities undertaken within the quality assurance system to verify that the requirements for quality of the study related activities have been fulfilled. (ICH)","C15311","QC","Quality Control"
