"id:ID","uri","label","extensible","notation","definition","identifier","alt_label","pref_label"
"38299","http://id.d4k.dk/dataset/cdisc/ct/v48/protocol/C132310-C184397","","","Reference","The curated list of sources that are cited within the reference section of the document.","C184397","Reference List","Reference List"
"38300","http://id.d4k.dk/dataset/cdisc/ct/v48/protocol/C132310-C174447","","","Study Arm","A planned pathway assigned to the subject as they progress through the study, usually referred to by a name that reflects one or more treatments, exposures, and/or controls included in the path.","C174447","Arm","Study Arm"
"38301","http://id.d4k.dk/dataset/cdisc/ct/v48/protocol/C132310-C154705","","","Study Contact Information","Information regarding the means of contacting a person or group that performs a function within a clinical study.","C154705","","Study Contact Information"
"38302","http://id.d4k.dk/dataset/cdisc/ct/v48/protocol/C132310-C15320","","","Study Design","A plan detailing how a study will be performed in order to represent the phenomenon under examination, to answer the research questions that have been asked, and informing the statistical approach.","C15320","","Study Design"
"38303","http://id.d4k.dk/dataset/cdisc/ct/v48/protocol/C132310-C142707","","","Study Monitoring","The act of overseeing the progress of a clinical study and of ensuring that it is conducted, recorded, and reported in accordance with the protocol, standard operating procedures (SOPs), good clinical practice (GCP), and regulatory requirement(s) where applicable. [after ICH E6 Glossary]","C142707","","Study Monitoring"
"38304","http://id.d4k.dk/dataset/cdisc/ct/v48/protocol/C132310-C93450","","","Study Oversight Entity","A group of individuals that approves, monitors and reviews biomedical research to protect the rights, safety and welfare of the study participants, by providing critical scientific, ethical, and/or regulatory oversight functions.","C93450","","Study Oversight Authority"
"38305","http://id.d4k.dk/dataset/cdisc/ct/v48/protocol/C132310-C70833","","","Study Population","A group of individuals taken from the general population who share a set of common characteristics, such as age, sex, or health condition, precisely defined in the study protocol. This is a population to which the study results could be reasonably generalized.","C70833","","Study Population"
"38306","http://id.d4k.dk/dataset/cdisc/ct/v48/protocol/C132310-C177924","","","Study Product Administration","The act of the dispensing, applying, or tendering a study product to the participant. (NCI)","C177924","","Study Product Administration"
"38307","http://id.d4k.dk/dataset/cdisc/ct/v48/protocol/C132310-C174271","","","Study Product","The material artifact(s), such as the trial product, interventional product, study drug, device, or procedure and their comparator(s), that is the focus of the study.","C174271","","Study Product"
"38308","http://id.d4k.dk/dataset/cdisc/ct/v48/protocol/C132310-C70817","","","Study Protocol","The formal plan of an experiment or research activity, including the objective, rationale, design, materials and methods for the conduct of the study, intervention description, and method of data analysis.","C70817","","Study Protocol"
"38309","http://id.d4k.dk/dataset/cdisc/ct/v48/protocol/C181168","Protocol Statement Attribute Terminology","False","Protocol Statement Attribute Terminology","A terminology value set relevant to the attributes of the protocol statement.","C181168","Protocol Statement Attribute Terminology","CDISC Protocol Statement Attribute Terminology"
"38310","http://id.d4k.dk/dataset/cdisc/ct/v48/protocol/C181168-C181244","","","Biological Sample Use Statement","A written message within the study protocol that describes the provisions for use of biological samples for the duration of the study and, as applicable, for future use.","C181244","Biological Specimen Use Statement;Biospecimen Use Statement","Biological Sample Use Statement"
"38311","http://id.d4k.dk/dataset/cdisc/ct/v48/protocol/C181168-C181240","","","Conflict of Interest Statement","A written message within the study protocol that describes how the study will manage actual or perceived conflicts of interest, including report to regulatory authorities and oversight entities.","C181240","","Conflict of Interest Statement"
"38312","http://id.d4k.dk/dataset/cdisc/ct/v48/protocol/C181168-C181237","","","Data Integrity Statement","A written message within the study protocol that asserts that the data are complete, consistent, accurate, trustworthy, and reliable throughout the life cycle of the study.","C181237","","Data Integrity Statement"
"38313","http://id.d4k.dk/dataset/cdisc/ct/v48/protocol/C181168-C184394","","","Data Sharing Statement","A written message within the study protocol that asserts compliance with data sharing policies.","C184394","","Data Sharing Compliance Policy Statement"
"38314","http://id.d4k.dk/dataset/cdisc/ct/v48/protocol/C181168-C181241","","","Financial Disclosure Statement","A written message within the study protocol that asserts how any and all financial interests of the study stakeholders will be managed in relation to the study.","C181241","","Study Protocol Financial Disclosure Statement"
"38315","http://id.d4k.dk/dataset/cdisc/ct/v48/protocol/C181168-C181236","","","Protocol Confidentiality Statement","A written message within the study protocol that asserts a statement of non-disclosure, such that information contained within the protocol document may only be shared with authorized parties.","C181236","","Protocol Confidentiality Statement"
"38316","http://id.d4k.dk/dataset/cdisc/ct/v48/protocol/C181168-C181235","","","Protocol Regulatory Compliance Statement","A written message within the study protocol that asserts that the study will be conducted in compliance with Good Clinical Practice (GCP) guidelines, study protocol, and any other applicable regulatory requirements.","C181235","Regulatory Compliance Statement","Protocol Regulatory Compliance Statement"
"38317","http://id.d4k.dk/dataset/cdisc/ct/v48/protocol/C181168-C184393","","","Publication Policy Statement","A written message within the study protocol that describes the policies pertaining to the publication of study results.","C184393","","Publication Policy Statement"
"38318","http://id.d4k.dk/dataset/cdisc/ct/v48/protocol/C181168-C181239","","","Statement of Ethical Conduct","A written message within the study protocol that asserts that the study will be conducted in accordance with the ethical principles outlined in the Declaration of Helsinki and applicable regional regulations and guidelines.","C181239","","Statement of Ethical Conduct"
"38319","http://id.d4k.dk/dataset/cdisc/ct/v48/protocol/C181168-C181238","","","Statement of Progress Reporting","A written message within the study protocol that asserts timely communication of study progress and results to the study stakeholders as well as regulatory authorities and study registries.","C181238","","Statement of Progress Reporting"
"38320","http://id.d4k.dk/dataset/cdisc/ct/v48/protocol/C181168-C184392","","","Study Investigator Conduct Statement","A written message within the study protocol that asserts that a study investigator will be responsible for the performance and conduct of the study as described in the protocol, and in accordance with relevant laws, regulations, and guidelines.","C184392","Investigator Statement;Study Investigator Statement","Study Investigator Conduct Statement"
"38321","http://id.d4k.dk/dataset/cdisc/ct/v48/protocol/C181168-C184391","","","Study Sponsor Conduct Statement","A written message within the study protocol that asserts that the study sponsor will be responsible for overseeing all aspects of study conduct.","C184391","Sponsor Statement;Study Sponsor Statement","Study Sponsor Conduct Statement"
"38322","http://id.d4k.dk/dataset/cdisc/ct/v48/protocol/C181168-C181243","","","Subject Data Confidentiality Statement","A written message within the study protocol that asserts compliance with applicable regulations and guidelines to preserve and maintain study data confidentiality.","C181243","Study Participant Data Confidentiality Statement","Subject Data Confidentiality Statement"
"38323","http://id.d4k.dk/dataset/cdisc/ct/v48/protocol/C181168-C181242","","","Subject Privacy Statement","A written message within the study protocol that asserts compliance with applicable regulations and guidelines regarding the protection of study subject, or participant, privacy.","C181242","Study Participant Privacy Statement","Subject Privacy Statement"
"38324","http://id.d4k.dk/dataset/cdisc/ct/v48/protocol/C147069","Randomization Type Value Set","False","Randomization Type Value Set","A terminology codelist relevant to the types of randomization schemas associated with a randomized controlled trial.","C147069","Randomization Type Value Set","CDISC Protocol Randomization Type Response Terminology"
"38325","http://id.d4k.dk/dataset/cdisc/ct/v48/protocol/C147069-C147126","","","Adaptive Randomization","A type of randomization schema in which the group assignment probability of a participant is adjusted based on the group assignments of those participants already randomized in the trial.","C147126","","Adaptive Randomization"
"38326","http://id.d4k.dk/dataset/cdisc/ct/v48/protocol/C147069-C147127","","","Block Randomization","A type of adaptive randomization in which a pre-specified number of participants is assigned to a block containing the same pre-specified number of balanced group assignments in random order.","C147127","Constrained Randomization","Block Randomization"
"38327","http://id.d4k.dk/dataset/cdisc/ct/v48/protocol/C147069-C147143","","","Minimization Randomization","A type of adaptive randomization in which the participant is assigned to the treatment group in an attempt to minimize imbalances in the number of participants for each stratification covariate across treatment groups.","C147143","Covariate Adaptive Randomization","Minimization Randomization"
"38328","http://id.d4k.dk/dataset/cdisc/ct/v48/protocol/C147069-C147144","","","Simple Randomization","A type of randomization schema in which each participant has the same chance of being randomized into any one group as all other participants.","C147144","Unrestricted Randomization","Simple Randomization"
"38329","http://id.d4k.dk/dataset/cdisc/ct/v48/protocol/C147069-C147145","","","Stratified Randomization","A type of block randomization in which participants are stratified into groups based on prognostic variables and then randomized into balanced treatment groups.","C147145","","Stratified Randomization"
"38330","http://id.d4k.dk/dataset/cdisc/ct/v48/protocol/C147069-C142743","","","Unequal Randomization","A type of randomization schema in which unequal numbers of participants are purposely assigned to multiple treatment groups.","C142743","","Unequal Randomization"
"38331","http://id.d4k.dk/dataset/cdisc/ct/v48/protocol/C184333","Reference Attribute Terminology","False","Reference Attribute Terminology","A terminology value set relevant to the attributes of the reference.","C184333","Reference Attribute Terminology","CDISC Protocol Reference Attribute Terminology"
"38332","http://id.d4k.dk/dataset/cdisc/ct/v48/protocol/C184333-C41196","","","Citation","A reference to an authoritative source.","C41196","","Citation"
"38333","http://id.d4k.dk/dataset/cdisc/ct/v48/protocol/C172329","Study Arm Attribute Terminology","False","Study Arm Attribute Terminology","A terminology value set relevant to the attributes of the study arm entity.","C172329","Study Arm Attribute Terminology","CDISC Protocol Study Arm Attribute Terminology"
"38334","http://id.d4k.dk/dataset/cdisc/ct/v48/protocol/C172329-C172458","","","Planned Number of Subjects Per Study Arm","The total number of subjects intended to be included within each arm for the study. (NCI)","C172458","","Planned Number of Subjects Per Study Arm"
"38335","http://id.d4k.dk/dataset/cdisc/ct/v48/protocol/C172329-C93728","","","Study Arm Description","The textual representation of the arm for the study.","C93728","Arm Description","Arm Description"
"38336","http://id.d4k.dk/dataset/cdisc/ct/v48/protocol/C172329-C172456","","","Study Arm Label","The given name of the arm for the study. (NCI)","C172456","Arm Label","Study Arm Label"
"38337","http://id.d4k.dk/dataset/cdisc/ct/v48/protocol/C172329-C172457","","","Study Arm Type","The identification of the kind of arm(s) for the study. (NCI)","C172457","Arm Type","Study Arm Type"
"38338","http://id.d4k.dk/dataset/cdisc/ct/v48/protocol/C174222","Study Arm Type Value Set Terminology","False","Study Arm Type Value Set Terminology","The terminology relevant to the identification of the kind of arm.","C174222","Study Arm Type Value Set Terminology","CDISC Protocol Study Arm Type Value Set Terminology"
"38339","http://id.d4k.dk/dataset/cdisc/ct/v48/protocol/C174222-C174267","","","Active Comparator Arm","An arm describing the active comparator.","C174267","","Active Comparator Arm"
"38340","http://id.d4k.dk/dataset/cdisc/ct/v48/protocol/C174222-C174226","","","Control Arm","An arm describing the intervention or treatment plan for a group of participants in the study receiving a control. The control may comprise a non-investigational product (active control) or regimen, placebo, or no treatment.","C174226","","Control Arm"
"38341","http://id.d4k.dk/dataset/cdisc/ct/v48/protocol/C174222-C174266","","","Experimental Arm","An arm describing the intervention or treatment plan for a group of participants in the study receiving test product(s).","C174266","Investigational Arm","Investigational Arm"
"38342","http://id.d4k.dk/dataset/cdisc/ct/v48/protocol/C174222-C174270","","","No Intervention Arm","A study arm without an intervention or treatment.","C174270","","No Intervention Arm"
"38343","http://id.d4k.dk/dataset/cdisc/ct/v48/protocol/C174222-C174268","","","Placebo Comparator Arm","An arm describing the placebo comparator.","C174268","Placebo Control Arm","Placebo Control Arm"
"38344","http://id.d4k.dk/dataset/cdisc/ct/v48/protocol/C174222-C174269","","","Sham Comparator Arm","An arm describing the sham comparator.","C174269","Sham Intervention Arm","Sham Comparator Arm"
"38345","http://id.d4k.dk/dataset/cdisc/ct/v48/protocol/C174222-C15538","","","Treatment Arm","An arm describing the intervention or treatment plan for a group of participants in the study. Treatment may consist of either experimental or control products under investigation.","C15538","","Protocol Treatment Arm"
"38346","http://id.d4k.dk/dataset/cdisc/ct/v48/protocol/C154682","Study Contact Information Attribute Terminology","False","Study Contact Information Attribute Terminology","A terminology value set relevant to the attributes of the study contact information entity.","C154682","Study Contact Information Attribute Terminology","CDISC Protocol Entities Study Contact Information Attribute Terminology"
"38347","http://id.d4k.dk/dataset/cdisc/ct/v48/protocol/C154682-C25354","","","Academic Degree","An academic rank conferred by a college, university, or other postsecondary education institution as official recognition for the successful completion of a program of studies.","C25354","","Academic Degree"
"38348","http://id.d4k.dk/dataset/cdisc/ct/v48/protocol/C154682-C42775","","","E-mail Address","A text string identifier for a location to which electronic mail can be delivered. (NCI)","C42775","Email Address","E-mail Address"
"38349","http://id.d4k.dk/dataset/cdisc/ct/v48/protocol/C154682-C42879","","","Fax Number","A telephone number that is used for identifying a specific fax machine in a telephone network.","C42879","Facsimile Number","Fax Number"
"38350","http://id.d4k.dk/dataset/cdisc/ct/v48/protocol/C154682-C154704","","","Organizational Affiliation","The name of the organization or entity that the person or group has an established relationship with.","C154704","","Organizational Affiliation Name"
"38351","http://id.d4k.dk/dataset/cdisc/ct/v48/protocol/C154682-C25191","","","Person Name","A word or group of words indicating the identity of a person usually consisting of a first (personal) name and a last (family) name with an optional middle name. In some cultural traditions the family name comes first.","C25191","Individual's Name;Name","Person Name"
"38352","http://id.d4k.dk/dataset/cdisc/ct/v48/protocol/C154682-C25407","","","Physical Address","A standardized representation of the location of a person, business, building, or organization. (NCI)","C25407","","Address"
"38353","http://id.d4k.dk/dataset/cdisc/ct/v48/protocol/C154682-C48835","","","Role","The usual or expected function of something; the part something plays in an action or event. (NCI)","C48835","","Role"
"38354","http://id.d4k.dk/dataset/cdisc/ct/v48/protocol/C154682-C40978","","","Telephone Number","A sequence of decimal digits (0-9) that is used for identifying a specific telephone line or other device in a telephone network.","C40978","Phone Number","Telephone Number"
"38355","http://id.d4k.dk/dataset/cdisc/ct/v48/protocol/C147066","Study Design Attribute Terminology","False","Study Design Attribute Terminology","A terminology value set relevant to the attributes of the study design entity.","C147066","Study Design Attribute Terminology","CDISC Protocol Entities Study Design Attribute Terminology"
"38356","http://id.d4k.dk/dataset/cdisc/ct/v48/protocol/C147066-C49068","","","Blinding","A process to limit bias by preventing subjects and/ or study personnel from identifying which treatments or procedures are administered, or from learning the results of tests and measures undertaken as part of a clinical investigation. (CDISC Glossary)","C49068","Masking","Blinded"
"38357","http://id.d4k.dk/dataset/cdisc/ct/v48/protocol/C147066-C98746","","","Interventional Study Design","The general design of the strategy for assigning interventions to participants in a clinical study. (clinicaltrials.gov)","C98746","Intervention Model","Intervention Model"
"38358","http://id.d4k.dk/dataset/cdisc/ct/v48/protocol/C147066-C147138","","","Observational Study Design","The general design of the strategy for identifying and following up with participants during observational studies. (clinicaltrials.gov)","C147138","Observation Model","Observational Study Model"
"38359","http://id.d4k.dk/dataset/cdisc/ct/v48/protocol/C147066-C147139","","","Overall Study Design","Summary description of the overall study plan and design, should include treatments studied, population studied, level and method of blinding/unmasking, kind of controls, method of assignment to treatment, sequence and duration of study periods, any safety, data monitoring or special steering or evaluation committees, and interim analyses. (ICH E3)","C147139","Overall Design;Study Design Description;Study Design Overview;Summary of Study Design","Study Design Description"
"38360","http://id.d4k.dk/dataset/cdisc/ct/v48/protocol/C147066-C52580","","","Participant Allocation","The process of assigning participants to particular treatment groups or cohorts in a clinical study.","C52580","Subject Allocation","Allocation"
"38361","http://id.d4k.dk/dataset/cdisc/ct/v48/protocol/C147066-C98771","","","Planned Number of Arms","The planned number of intervention groups.","C98771","Planned Number of Arms","Planned Number of Arms"
"38362","http://id.d4k.dk/dataset/cdisc/ct/v48/protocol/C147066-C147137","","","Planned Number of Cohorts","The planned number of study groups.","C147137","","Planned Number of Cohorts"
"38363","http://id.d4k.dk/dataset/cdisc/ct/v48/protocol/C147066-C49692","","","Planned Number of Participants","The planned number of subjects to be entered in a clinical trial. (NCI)","C49692","Anticipated Enrollment;Planned Enrollment;Planned Number of Subjects;Target Enrollment","Planned Subject Number"
"38364","http://id.d4k.dk/dataset/cdisc/ct/v48/protocol/C147066-C147140","","","Randomization Type","A characterization or classification of the process of assigning trial subjects to treatment or control groups using an element of chance to determine the assignments in order to reduce bias.","C147140","","Randomization Method"
"38365","http://id.d4k.dk/dataset/cdisc/ct/v48/protocol/C147066-C16153","","","Stratification Factor","Selected factors that are used during randomization to ensure there is balance of these factors across all subjects within each arm of a study. The subject level values of these factors may be used as fixed effects in statistical models and for sensitivity analyses.","C16153","Stratification Factor","Stratification Factors"
"38366","http://id.d4k.dk/dataset/cdisc/ct/v48/protocol/C147066-C25689","","","Stratification","Grouping defined by important prognostic factors measured at baseline. (ICH E9)","C25689","","Stratification"
"38367","http://id.d4k.dk/dataset/cdisc/ct/v48/protocol/C147066-C142705","","","Study Design Rationale","Reason(s) for choosing the study design. This may include reasons for the choice of control or comparator, as well as the scientific rationale for the study design.","C142705","","Study Design Rationale"
"38368","http://id.d4k.dk/dataset/cdisc/ct/v48/protocol/C147066-C142668","","","Study Hypothesis","A supposition or proposal made to explain certain observations or facts, which requires further investigation or exploration within a clinical study. (NCI)","C142668","","Research Hypothesis"
"38369","http://id.d4k.dk/dataset/cdisc/ct/v48/protocol/C147066-C147141","","","Study Primary Purpose","The principal reason or intention for the execution of an interventional or non-interventional clinical study. (NCI)","C147141","","Study Primary Purpose"
"38370","http://id.d4k.dk/dataset/cdisc/ct/v48/protocol/C147066-C147142","","","Study Secondary Purpose","The ancillary reason or intention for the execution of an interventional or non-interventional clinical study. (NCI)","C147142","","Study Secondary Purpose"
"38371","http://id.d4k.dk/dataset/cdisc/ct/v48/protocol/C147066-C49658","","","Trial Blinding Schema","The type of experimental design used to describe the level of awareness of the clinical trial subjects and/or investigators of the intervention(s) that they are receiving and/or administering.","C49658","Trial Blinding Schema","Trial Blinding Schema"
"38372","http://id.d4k.dk/dataset/cdisc/ct/v48/protocol/C163026","Study Monitoring Attribute Terminology","False","Study Monitoring Attribute Terminology","A terminology value set relevant to the attributes of the study monitoring entity.","C163026","Study Monitoring Attribute Terminology","CDISC Protocol Study Monitoring Attribute Terminology"
"38373","http://id.d4k.dk/dataset/cdisc/ct/v48/protocol/C163026-C115753","","","Clinical Monitoring Plan","A description of the strategy, methods, responsibilities, and requirements for monitoring the study. (ICH E6(R2))","C115753","","Clinical Trial Monitoring Plan"
"38374","http://id.d4k.dk/dataset/cdisc/ct/v48/protocol/C163026-C163406","","","Data and Safety Monitoring Plan","A written plan that prospectively identifies and documents monitoring activities intended to protect the safety of the participants, the validity of the data and the integrity of the research study. The DSMP may also identify when to terminate a participant's participation (i.e. individual stopping rules) and/or the appropriate termination of a study (i.e. study stopping rules). (Mayo Clinic)","C163406","Data Safety Monitoring Plan;DSMP;Safety Data Monitoring Plan","Data and Safety Monitoring Plan"
"38375","http://id.d4k.dk/dataset/cdisc/ct/v48/protocol/C163026-C142488","","","Data Monitoring","Review of study data for completeness, consistency, and accuracy for the duration of the study lifecycle.","C142488","","Data Monitoring"
"38376","http://id.d4k.dk/dataset/cdisc/ct/v48/protocol/C163026-C163407","","","GCP Adherence Statement","A written message that asserts, affirms, or declares that the study is conducted in accordance with Good Clinical Practice (GCP).","C163407","Good Clinical Practice Adherence Statement","GCP Adherence Statement"
"38377","http://id.d4k.dk/dataset/cdisc/ct/v48/protocol/C163026-C142674","","","Risk Monitoring","A systematic, prioritized approach that involves identifying, assessing, monitoring and mitigating the risks that could affect the quality of the study or safety of the study participants.","C142674","","Risk Based Monitoring"
"38378","http://id.d4k.dk/dataset/cdisc/ct/v48/protocol/C163026-C163408","","","Safety Data Monitoring","Review of cumulative safety data to identify possible safety concerns.","C163408","","Safety Data Monitoring"
"38379","http://id.d4k.dk/dataset/cdisc/ct/v48/protocol/C163026-C163409","","","Safety Monitoring","Review of safety data to ensure safety of the individuals who are participating in the study, or to identify potential safety concerns for the duration of the study lifecycle.","C163409","","Safety Monitoring"
"38380","http://id.d4k.dk/dataset/cdisc/ct/v48/protocol/C163026-C184395","","","Study Audit Statement","A written message within the study protocol that describes the auditing activities that are to occur within a study and the intent to address findings from an audit report.","C184395","","Study Audit Statement"
"38381","http://id.d4k.dk/dataset/cdisc/ct/v48/protocol/C163026-C184396","","","Study Audit","A systematic and independent examination of study-related activities and documents to determine whether the evaluated trial-related activities were conducted and the data were recorded, analyzed, and accurately reported according to the protocol, sponsor's standard operating procedures (SOPs), good clinical practice (GCP), and the applicable regulatory requirement(s). (ICH E6 Glossary)","C184396","","Study Audit"
