"id","alt_label","definition","identifier","notation","pref_label","uri"
"3942","","The spinous process of the 5th lumbar vertebra.","C116163","5TH LUMBAR SPINOUS PROCESS","Fifth Lumbar Spinous Process","http://id.d4k.dk/dataset/cdisc/ct/v48/sdtm/C74456-C116163"
"3943","","The portion of the descending aorta that lies within the abdomen, beginning below the diaphragm and ending at its division into the right and left common iliac arteries. (NCI)","C32038","ABDOMINAL AORTA","Abdominal Aorta","http://id.d4k.dk/dataset/cdisc/ct/v48/sdtm/C74456-C32038"
"3944","Abdomen","The body cavity between the thoracic and pelvic cavities in mammals.","C12664","ABDOMINAL CAVITY","Abdomen","http://id.d4k.dk/dataset/cdisc/ct/v48/sdtm/C74456-C12664"
"3945","","Any lymph node within the abdomen.","C12360","ABDOMINAL LYMPH NODE","Intra-Abdominal Lymph Node","http://id.d4k.dk/dataset/cdisc/ct/v48/sdtm/C74456-C12360"
"3946","","Any portion of the body that lies within the boundary, either internally or externally, of the abdomen: superior margin, the thorax; inferior margin, the pelvis; lateral margins, the ribs.","C139186","ABDOMINAL REGION","Abdominal Region","http://id.d4k.dk/dataset/cdisc/ct/v48/sdtm/C74456-C139186"
"3947","Abdominal Skin","The integument that covers the abdomen.","C52758","ABDOMINAL SKIN","Abdominal Skin","http://id.d4k.dk/dataset/cdisc/ct/v48/sdtm/C74456-C52758"
"3948","","The tissue that surrounds the organs present in the abdominal cavity.","C77608","ABDOMINAL WALL","Abdominal Wall","http://id.d4k.dk/dataset/cdisc/ct/v48/sdtm/C74456-C77608"
"3949","","The sixth cranial nerve.","C12665","ABDUCENS NERVE","Abducens Nerve","http://id.d4k.dk/dataset/cdisc/ct/v48/sdtm/C74456-C12665"
"3950","","A muscle of the hand, in general extending from the pisiform bone, the pisohamate ligament, and the flexor retinaculum to the ulnopalmar margin of the proximal phalanx. Primary function is abduction of the little finger and flexion of the phalanx nearest the hand.","C165996","ABDUCTOR DIGITI MINIMI MUSCLE OF THE HAND","Abductor Digiti Minimi Muscle of the Hand","http://id.d4k.dk/dataset/cdisc/ct/v48/sdtm/C74456-C165996"
"3951","Abductor Digiti Minimi;Abductor Minimi Digiti","A muscle in the foot, in general extending from the medial and lateral processes of the posterior calcaneal tuberosity to the lateral side of the base of the proximal phalanx of the fifth toe and the fifth metatarsal; primary function is to abduct the fifth toe at the metatarsophalangeal joint and support the lateral arch.","C163504","ABDUCTOR DIGITI QUINTI MUSCLE","Abductor Digiti Minimi Muscle","http://id.d4k.dk/dataset/cdisc/ct/v48/sdtm/C74456-C163504"
"3952","","A muscle in the foot, in general extending from the medial process of the posterior calcaneal tuberosity to the medial side of the base of the proximal phalanx of the big toe; primary function is to abduct and flex the big toe at the metatarsophalangeal joint.","C163505","ABDUCTOR HALLUCIS MUSCLE","Abductor Hallucis Muscle","http://id.d4k.dk/dataset/cdisc/ct/v48/sdtm/C74456-C163505"
"3953","","A muscle of the hand, in general extending from the flexor retinaculum and the tubercles of the scaphoid and trapezium bones to the outer side of the base of the proximal phalanx of the thumb. Primary function is abduction of the thumb away from the palm.","C165997","ABDUCTOR POLLICIS BREVIS MUSCLE","Abductor Pollicis Brevis Muscle","http://id.d4k.dk/dataset/cdisc/ct/v48/sdtm/C74456-C165997"
"3954","","An additional renal vessel originating from the aorta and entering the kidney at the proximal or distal end of the organ. Accessory renal arteries are found in 26-30% of humans.","C116183","ACCESSORY RENAL ARTERY","Accessory Renal Artery","http://id.d4k.dk/dataset/cdisc/ct/v48/sdtm/C74456-C116183"
"3955","Acetabulum","Two cup shaped areas, one each on the lateral side of the lower pelvis that house the head of the femur to form the ball and socket joint of the hip. (NCI)","C32042","ACETABULUM","Acetabulum","http://id.d4k.dk/dataset/cdisc/ct/v48/sdtm/C74456-C32042"
"3956","","The tendon that, in general, attaches the gastrocnemius muscle to the calcaneous bone in the tarsus.","C32043","ACHILLES TENDON","Achilles Tendon","http://id.d4k.dk/dataset/cdisc/ct/v48/sdtm/C74456-C32043"
"3957","Acromioclavicular Joint","The junction of the upper distal end of the scapula to the distal edge of the collarbone, also known as the acromion and the clavicle. (NCI)","C32047","ACROMIOCLAVICULAR JOINT","Acromioclavicular Joint","http://id.d4k.dk/dataset/cdisc/ct/v48/sdtm/C74456-C32047"
"3958","Acromion","The upper distal process of the scapula. (NCI)","C32048","ACROMION","Acromion","http://id.d4k.dk/dataset/cdisc/ct/v48/sdtm/C74456-C32048"
"3959","ACUTE MARGINAL ARTERY SEGMENT(S);AMARG","The arteries that arise at the junction of the proximal and mid-right coronary artery conduit segments.","C102285","ACUTE MARGINAL ARTERY","Acute Marginal Artery","http://id.d4k.dk/dataset/cdisc/ct/v48/sdtm/C74456-C102285"
"3960","","A muscle in the leg, in general extending from the external surface of the body of pubis and the anterior surface of the inferior pubic ramus to the pectineal line and the medial lip of the linea aspera; primary function is to adduct, flex, and rotate the thigh.","C163506","ADDUCTOR BREVIS MUSCLE","Adductor Brevis Muscle","http://id.d4k.dk/dataset/cdisc/ct/v48/sdtm/C74456-C163506"
"3961","","The larger of two heads of the adductor hallucis muscle, in general originating from the sheath of the peroneus longus tendon and the plantar surface of the bases of the second to fourth metatarsal bones in the foot.","C163507","ADDUCTOR HALLUCIS MUSCLE, OBLIQUE HEAD","Oblique Head of Adductor Hallucis Muscle","http://id.d4k.dk/dataset/cdisc/ct/v48/sdtm/C74456-C163507"
"3962","","The smaller of two heads of the adductor hallucis muscle, in general originating from the deep transverse metatarsal ligament and the plantar surface of the metatarsophalangeal joints of the lateral three toes.","C163508","ADDUCTOR HALLUCIS MUSCLE, TRANSVERSE HEAD","Transverse Head of Adductor Hallucis Muscle","http://id.d4k.dk/dataset/cdisc/ct/v48/sdtm/C74456-C163508"
"3963","","A muscle in the thigh, in general extending from the external surface of the body of pubis to the middle third of the linea aspera; primary function is to adduct and medially rotate the thigh.","C163509","ADDUCTOR LONGUS MUSCLE","Adductor Longus Muscle","http://id.d4k.dk/dataset/cdisc/ct/v48/sdtm/C74456-C163509"
"3964","","A muscle in the thigh, in general extending from the ischiopubic ramus and ischial tuberosity to the gluteal tuberosity of the femur, medial lip of the linea aspera, medial supracondylar ridge, and adductor tubercle; primary function is to adduct, flex, extend, and medially rotate the thigh at the hip joint.","C163510","ADDUCTOR MAGNUS MUSCLE","Adductor Magnus Muscle","http://id.d4k.dk/dataset/cdisc/ct/v48/sdtm/C74456-C163510"
"3965","","A skeletal muscle of the forearm originating from the posterior surfaces of the ulna and radius and the interosseous membrane. (NCI)","C52888","ADDUCTOR POLLICIS MUSCLE","Abductor Pollicis Longus","http://id.d4k.dk/dataset/cdisc/ct/v48/sdtm/C74456-C52888"
"3966","","The endocrine glands adjacent to the kidneys that consist of the outer adrenal cortex and the inner adrenal medulla in mammals.","C12666","ADRENAL GLAND","Adrenal Gland","http://id.d4k.dk/dataset/cdisc/ct/v48/sdtm/C74456-C12666"
"3967","Alveoli","Any of the terminal sacs in the lungs through which gas exchange takes place with the pulmonary capillary blood.","C12986","ALVEOLUS","Alveolus","http://id.d4k.dk/dataset/cdisc/ct/v48/sdtm/C74456-C12986"
"3968","Amygdala;Amygdaloid Body;Amygdaloid Nucleus","A group of nuclei adjacent to the lateral ventricle of the brain within the temporal lobe, and is part of the limbic system.","C12440","AMYGDALA","Amygdala","http://id.d4k.dk/dataset/cdisc/ct/v48/sdtm/C74456-C12440"
"3969","","The terminal section of the alimentary canal, which extends from the anorectal junction and ends at the anal opening. (NCI)","C12375","ANAL CANAL","Anal Canal","http://id.d4k.dk/dataset/cdisc/ct/v48/sdtm/C74456-C12375"
"3970","","The transitional zone between the moist, hairless, modified skin of the anal canal and the perianal skin.","C25419","ANAL VERGE","Anal Margin","http://id.d4k.dk/dataset/cdisc/ct/v48/sdtm/C74456-C25419"
"3971","Anastomosis","A natural or surgically-induced connection between tubular structures in the body. (NCI)","C15609","ANASTOMOSIS","Anastomosis","http://id.d4k.dk/dataset/cdisc/ct/v48/sdtm/C74456-C15609"
"3972","","A ridge on the posterior part of the inferior parietal lobule.","C32077","ANGULAR GYRUS","Angular Gyrus","http://id.d4k.dk/dataset/cdisc/ct/v48/sdtm/C74456-C32077"
"3973","","The tendons in the anterior compartment of the leg that cross the tibiotalar joint anteriorly and connect muscles that originate on the surfaces of the tibia and fibula to bones in the toes, enabling dorsiflexion of the foot at the ankle and extension of the toes. (NCI)","C161390","ANKLE JOINT ANTERIOR EXTENSOR TENDONS","Ankle Joint Anterior Extensor Tendons","http://id.d4k.dk/dataset/cdisc/ct/v48/sdtm/C74456-C161390"
"3974","","The tendons in the anterior compartment of the leg that connect muscles that originate on the surfaces of the femur, tibia, and fibula to bones in the toes, enabling plantar flexion of the foot at the ankle. (NCI)","C161389","ANKLE JOINT ANTERIOR FLEXOR TENDONS","Ankle Joint Anterior Flexor Tendons","http://id.d4k.dk/dataset/cdisc/ct/v48/sdtm/C74456-C161389"
"3975","Ankle;Ankle Joint","A gliding joint between the distal ends of the tibia and fibula and the proximal end of the talus. (NCI)","C32078","ANKLE JOINT","Ankle Joint","http://id.d4k.dk/dataset/cdisc/ct/v48/sdtm/C74456-C32078"
"3976","Talar Mortise","A rectangular socket or bony arch that connects the ends of the tibia and fibula to the talus.","C117868","ANKLE MORTISE","Ankle Mortise","http://id.d4k.dk/dataset/cdisc/ct/v48/sdtm/C74456-C117868"
"3977","","A triangular space on the anterior side of the elbow joint. Three main veins of the arm, the brachial artery, the medial nerve and the tendon of the biceps muscle pass through this space.","C103238","ANTECUBITAL FOSSA","Antecubital Fossa","http://id.d4k.dk/dataset/cdisc/ct/v48/sdtm/C74456-C103238"
"3978","","The part of the cingulate cortex that lies most frontal, with the most anterior portion of the cortex bending in a horseshoe shape around the genu of the corpus callosum.","C139185","ANTERIOR CINGULATE CORTEX","Anterior Cingulate Cortex","http://id.d4k.dk/dataset/cdisc/ct/v48/sdtm/C74456-C139185"
"3979","","The part of the cingulate gyrus that lies inferior to the superior frontal gyrus, and is separated from it by the cingulate sulcus; it ends inferior to the rostrum of the corpus callosum.","C96217","ANTERIOR CINGULATE GYRUS","Cingulate Gyrus","http://id.d4k.dk/dataset/cdisc/ct/v48/sdtm/C74456-C96217"
"3980","Frontal Horn of the Lateral Ventricle","The part of the lateral ventricle located in the frontal lobe, anterior to the interventricular foramen of Monroe, and bounded by the septum pellucidum, fornix, and genu of the corpus callosum.","C32637","ANTERIOR HORN OF THE LATERAL VENTRICLE","Frontal Horn of the Lateral Ventricle","http://id.d4k.dk/dataset/cdisc/ct/v48/sdtm/C74456-C32637"
"3981","AICA","A basilar artery branch that supplies the anterior portion of the inferior surface of the cerebellum.","C32091","ANTERIOR INFERIOR CEREBELLAR ARTERY","Anterior Inferior Cerebellar Artery","http://id.d4k.dk/dataset/cdisc/ct/v48/sdtm/C74456-C32091"
"3982","","A bony projection from the anterior region of the iliac crest, and is the site of attachment for the sartorius and tensor fascia latae muscles and the inguinal ligament.","C139187","ANTERIOR SUPERIOR ILIAC SPINE","Anterior Superior Iliac Spine","http://id.d4k.dk/dataset/cdisc/ct/v48/sdtm/C74456-C139187"
"3983","","An artery of the lower extremity that supplies blood to the anterior part of the leg and the foot.","C12825","ANTERIOR TIBIAL ARTERY","Anterior Tibial Artery","http://id.d4k.dk/dataset/cdisc/ct/v48/sdtm/C74456-C12825"
"3984","","The vein that runs parallel to the anterior tibial artery and empties into the popliteal vein.","C32115","ANTERIOR TIBIAL VEIN","Anterior Tibial Vein","http://id.d4k.dk/dataset/cdisc/ct/v48/sdtm/C74456-C32115"
"3985","Antrum Pylori","The initial part of the pyloric canal of the stomach. This site contains endocrine cells that produce gastrin and somatostatin. (NCI)","C12259","ANTRUM PYLORI","Antrum Pylori","http://id.d4k.dk/dataset/cdisc/ct/v48/sdtm/C74456-C12259"
"3986","","The distal orifice of the digestive tract located between the rectum and the external surface of the body, comprising glandular, transitional, and squamous epithelium.","C43362","ANUS","Anus","http://id.d4k.dk/dataset/cdisc/ct/v48/sdtm/C74456-C43362"
"3987","","The major artery of the body; it arises from the left ventricle of the heart and terminally bifurcates into the common iliac arteries.","C12669","AORTA","Aorta","http://id.d4k.dk/dataset/cdisc/ct/v48/sdtm/C74456-C12669"
"3988","Aortic Arch","The curved segment of the aorta between the ascending and the descending segments.","C32123","AORTIC ARCH","Aortic Arch","http://id.d4k.dk/dataset/cdisc/ct/v48/sdtm/C74456-C32123"
"3989","","A fibrous membrane that attaches to, and provides support for, the aortic valve leaflets.","C130167","AORTIC VALVE ANNULUS","Aortic Valve Annulus","http://id.d4k.dk/dataset/cdisc/ct/v48/sdtm/C74456-C130167"
"3990","","A cardiac valve located between the left ventricle and the aorta.","C12670","AORTIC VALVE","Aortic Valve","http://id.d4k.dk/dataset/cdisc/ct/v48/sdtm/C74456-C12670"
"3991","Aortic Valve, Left Semilunar Cusp","The cusp of the aortic valve that overlies the left coronary ostium.","C127638","AORTIC VALVE, LEFT CORONARY CUSP","Left Coronary Cusp of the Aortic Valve","http://id.d4k.dk/dataset/cdisc/ct/v48/sdtm/C74456-C127638"
"3992","Aortic Valve, Posterior Semilunar Cusp","The cusp of the aortic valve that is positioned posteriorly relative to the left and right aortic cusps.","C127639","AORTIC VALVE, NON-CORONARY CUSP","Non-Coronary Cusp of the Aortic Valve","http://id.d4k.dk/dataset/cdisc/ct/v48/sdtm/C74456-C127639"
"3993","Aortic Valve, Right Semilunar Cusp","The cusp of the aortic valve that overlies the right coronary ostium.","C127640","AORTIC VALVE, RIGHT CORONARY CUSP","Right Coronary Cusp of the Aortic Valve","http://id.d4k.dk/dataset/cdisc/ct/v48/sdtm/C74456-C127640"
"3994","","The segment of the blood vessels that includes the iliac artery and its origin from the aorta.","C116166","AORTO-ILIAC PERIPHERAL ARTERY","Aortoiliac Artery Segment","http://id.d4k.dk/dataset/cdisc/ct/v48/sdtm/C74456-C116166"
"3995","","A lymph node located in the area between the abdominal aorta and inferior vena cava. (NCI)","C118775","AORTOCAVAL LYMPH NODE","Aortocaval Lymph Node","http://id.d4k.dk/dataset/cdisc/ct/v48/sdtm/C74456-C118775"
"3996","","A lymph node located in the aortopulmonary window.","C116165","AORTOPULMONARY WINDOW LYMPH NODE","Aortopulmonary Window Lymph Node","http://id.d4k.dk/dataset/cdisc/ct/v48/sdtm/C74456-C116165"
"3997","","The distal end of the appendix. (NCI)","C83470","APPENDICEAL TIP","Appendiceal Tip","http://id.d4k.dk/dataset/cdisc/ct/v48/sdtm/C74456-C83470"
"3998","","The part of the skeleton that includes the bones of the upper and lower limbs, including the shoulder and pelvic girdles","C49477","APPENDICULAR SKELETON","Appendicular Skeleton","http://id.d4k.dk/dataset/cdisc/ct/v48/sdtm/C74456-C49477"
"3999","","A pouch-like tissue attached to the cecum, which may exist as a diverticulum.","C12380","APPENDIX","Appendix","http://id.d4k.dk/dataset/cdisc/ct/v48/sdtm/C74456-C12380"
"4000","Arm Skin","The integument that covers the arm.","C52754","ARM SKIN","Arm Skin","http://id.d4k.dk/dataset/cdisc/ct/v48/sdtm/C74456-C52754"
"4001","Arm;Brachium;Upper Arm","The portion of the upper extremity between the shoulder and the elbow.","C32141","ARM","Arm","http://id.d4k.dk/dataset/cdisc/ct/v48/sdtm/C74456-C32141"
"4002","Artery","A blood vessel that carries blood away from the heart. (NCI)","C12372","ARTERY","Artery","http://id.d4k.dk/dataset/cdisc/ct/v48/sdtm/C74456-C12372"
"4003","","The portion of the aorta that emerges from the left ventricle and precedes the aortic arch.","C32150","ASCENDING AORTA","Ascending Aorta","http://id.d4k.dk/dataset/cdisc/ct/v48/sdtm/C74456-C32150"
"4004","","The portion of the ascending aorta between the aortic annulus and the sinotubular junction.","C127641","ASCENDING AORTA, AORTIC ROOT","Aortic Root","http://id.d4k.dk/dataset/cdisc/ct/v48/sdtm/C74456-C127641"
"4005","","The terminus of the aortic root; the point at which the aorta attains a tubular configuration.","C127642","ASCENDING AORTA, SINOTUBULAR JUNCTION","Sinotubular Junction","http://id.d4k.dk/dataset/cdisc/ct/v48/sdtm/C74456-C127642"
"4006","","Any one of the naturally occurring sinuses of the aortic root distal to the semilunar valve.","C33557","ASCENDING AORTA, SINUS OF VALSALVA","Sinus of Valsalva","http://id.d4k.dk/dataset/cdisc/ct/v48/sdtm/C74456-C33557"
"4007","","Either of the two valves in the heart situated between the atria and ventricles, i.e., the mitral valve or the tricuspid valve.","C176322","ATRIOVENTRICULAR VALVE","Atrioventricular Valve","http://id.d4k.dk/dataset/cdisc/ct/v48/sdtm/C74456-C176322"
"4008","","The part of the skeleton that includes the skull and spinal column and sternum and ribs. (NCI)","C32172","AXIAL SKELETON","Axial Skeleton","http://id.d4k.dk/dataset/cdisc/ct/v48/sdtm/C74456-C32172"
"4009","Armpit;Axilla","The underside concavity where the arm and the shoulder are joined. (NCI)","C12674","AXILLA","Axilla","http://id.d4k.dk/dataset/cdisc/ct/v48/sdtm/C74456-C12674"
"4010","","An artery that originates from the subclavian artery at the lateral margin of the first rib. It supplies the brachial artery.","C32169","AXILLARY ARTERY","Axillary Artery","http://id.d4k.dk/dataset/cdisc/ct/v48/sdtm/C74456-C32169"
"4011","","Axillary lymph nodes located inferolateral to pectoralis minor.","C123461","AXILLARY LYMPH NODE LEVEL I","Axillary Lymph Node Level I","http://id.d4k.dk/dataset/cdisc/ct/v48/sdtm/C74456-C123461"
"4012","","Axillary lymph nodes located posterior to pectoralis minor.","C123462","AXILLARY LYMPH NODE LEVEL II","Axillary Lymph Node Level II","http://id.d4k.dk/dataset/cdisc/ct/v48/sdtm/C74456-C123462"
"4013","","Axillary lymph nodes located superomedial to pectoralis minor.","C123463","AXILLARY LYMPH NODE LEVEL III","Axillary Lymph Node Level III","http://id.d4k.dk/dataset/cdisc/ct/v48/sdtm/C74456-C123463"
"4014","","Lymph node(s) in the axillary region.","C12904","AXILLARY LYMPH NODE","Axillary Lymph Node","http://id.d4k.dk/dataset/cdisc/ct/v48/sdtm/C74456-C12904"
"4015","","A large blood vessel which returns blood to the heart from the lateral thorax, axilla and upper limb. Each side of the body contains one axillary vein.","C32171","AXILLARY VEIN","Axillary Vein","http://id.d4k.dk/dataset/cdisc/ct/v48/sdtm/C74456-C32171"
"4016","","A blood vessel which returns blood to the heart from the posterior walls of the thorax and abdomen.","C53029","AZYGOS VEIN","Azygos Vein","http://id.d4k.dk/dataset/cdisc/ct/v48/sdtm/C74456-C53029"
"4017","Back","The dorsal area between the base of the neck and the sacrum. (NCI)","C13062","BACK","Back","http://id.d4k.dk/dataset/cdisc/ct/v48/sdtm/C74456-C13062"
"4018","","Clusters of neurons comprising the globus pallidus, putamen, caudate, nucleus accumbens, substantia nigra and subthalamic nucleus.","C12447","BASAL GANGLIA","Basal Ganglia","http://id.d4k.dk/dataset/cdisc/ct/v48/sdtm/C74456-C12447"
"4019","Basilic Vein","One of the moderately large superficial veins of the forearm that transports blood from the hand and the medial aspect of the forearm to the axillary vein. (NCI)","C32197","BASILIC VEIN","Basilic Vein","http://id.d4k.dk/dataset/cdisc/ct/v48/sdtm/C74456-C32197"
"4020","","A muscle of the proximal arm/forelimb, in general extending from the scapula to the radius and adjacent fascia; primary function is flexion of the elbow joint and, in some species, also functions in supination of the antebrachium.","C32200","BICEPS BRACHII MUSCLE","Biceps Brachii","http://id.d4k.dk/dataset/cdisc/ct/v48/sdtm/C74456-C32200"
"4021","","A muscle in the thigh, in general extending from the ischial tuberosity and posterior femur to the fibula; primary function is to extend the femorotibial joint.","C53147","BICEPS FEMORIS MUSCLE","Biceps Femoris","http://id.d4k.dk/dataset/cdisc/ct/v48/sdtm/C74456-C53147"
"4022","","Any of the ducts conveying bile between the liver and the intestine, including hepatic, cystic, and common bile duct.","C12376","BILE DUCT","Bile Duct","http://id.d4k.dk/dataset/cdisc/ct/v48/sdtm/C74456-C12376"
"4023","Biliary Tract","The duct system that transports bile from its origination by hepatocytes in the liver to the small intestine. It is comprised of the common bile duct that connects the liver and gall bladder to the small intestine and the cystic duct that connects the gall bladder to the common bile duct. (NCI)","C12678","BILIARY TRACT","Biliary Tract","http://id.d4k.dk/dataset/cdisc/ct/v48/sdtm/C74456-C12678"
"4024","","The tissue layers that form the urinary bladder. They include the mucosa, submucosa, smooth muscle, and serosa.","C48941","BLADDER WALL","Bladder Wall","http://id.d4k.dk/dataset/cdisc/ct/v48/sdtm/C74456-C48941"
"4025","Urinary Bladder","The distensible sac-like organ that functions as a reservoir of urine, collecting from the kidneys and eliminating via the urethra. (NCI)","C12414","BLADDER","Bladder","http://id.d4k.dk/dataset/cdisc/ct/v48/sdtm/C74456-C12414"
"4026","Dome of the Bladder","The upper, convex surface of the bladder. (NCI)","C12332","BLADDER, DOME","Dome of the Bladder","http://id.d4k.dk/dataset/cdisc/ct/v48/sdtm/C74456-C12332"
"4027","Fundus of the Bladder","The portion of the bladder that is formed by the posterior wall and is located opposite to the bladder opening. (NCI)","C48939","BLADDER, FUNDUS","Bladder Fundus","http://id.d4k.dk/dataset/cdisc/ct/v48/sdtm/C74456-C48939"
"4028","Neck of the Bladder","The inferior portion of the urinary bladder which is formed as the walls of the bladder converge and become contiguous with the proximal urethra. (NCI)","C12336","BLADDER, NECK","Bladder Neck","http://id.d4k.dk/dataset/cdisc/ct/v48/sdtm/C74456-C12336"
"4029","Trigone of the Bladder","The triangular area in the bladder mucosa that is formed by the two ureteral orifices and the urethral orifice. (NCI)","C12331","BLADDER, TRIGONE","Bladder Trigone","http://id.d4k.dk/dataset/cdisc/ct/v48/sdtm/C74456-C12331"
"4030","","A tubular structure through which the blood circulates in the body. Blood vessels constitute a network composed of arteries, arterioles, capillaries, venules, and veins. (NCI)","C12679","BLOOD VESSEL","Blood Vessel","http://id.d4k.dk/dataset/cdisc/ct/v48/sdtm/C74456-C12679"
"4031","Peripheral Blood;Whole Blood","A liquid tissue with the primary function of transporting oxygen and carbon dioxide. It supplies the tissues with nutrients, removes waste products, and contains various components of the immune system defending the body against infection.","C12434","BLOOD","Blood","http://id.d4k.dk/dataset/cdisc/ct/v48/sdtm/C74456-C12434"
"4032","Body of Stomach","The main section of the digestive tube that connects the esophagus to the small intestine. The body proper excludes the upper and lower sections of the fundus and pyloric portion respectively. (NCI)","C12258","BODY OF STOMACH","Body of Stomach","http://id.d4k.dk/dataset/cdisc/ct/v48/sdtm/C74456-C12258"
"4033","Whole Body","The entire physical structure of an organism. It is composed of anatomic systems, regions, cavities, and spaces. (NCI)","C13041","BODY","Body","http://id.d4k.dk/dataset/cdisc/ct/v48/sdtm/C74456-C13041"
"4034","","The tissue occupying the spaces of some bones. It consists of blood vessel sinuses and a network of hematopoietic cells.","C12431","BONE MARROW","Bone Marrow","http://id.d4k.dk/dataset/cdisc/ct/v48/sdtm/C74456-C12431"
"4035","","Calcified connective tissue that forms the skeletal components of the body. (NCI)","C12366","BONE","Bone","http://id.d4k.dk/dataset/cdisc/ct/v48/sdtm/C74456-C12366"
"4036","","An artery of the forelimb; in general it arises from the axillary artery and branches to form the radial and ulnar arteries.","C12681","BRACHIAL ARTERY","Brachial Artery","http://id.d4k.dk/dataset/cdisc/ct/v48/sdtm/C74456-C12681"
"4037","","Lymph node(s) adjacent to the brachial vein.","C92221","BRACHIAL LYMPH NODE","Brachial Lymph Node","http://id.d4k.dk/dataset/cdisc/ct/v48/sdtm/C74456-C92221"
"4038","Brachial Plexus","A nerve network originating from spinal nerves in the cervical and thoracic vertebrae and giving rise to multiple nerves that innervate the arm/forelimb.","C12682","BRACHIAL PLEXUS","Brachial Plexus","http://id.d4k.dk/dataset/cdisc/ct/v48/sdtm/C74456-C12682"
"4039","","A vein of the arm/forelimb; in general it arises from the union of the radial and ulnar veins and drains into the axillary vein.","C12883","BRACHIAL VEIN","Brachial Vein","http://id.d4k.dk/dataset/cdisc/ct/v48/sdtm/C74456-C12883"
"4040","","A muscle that originates from the lower two-thirds of the anterior surface of the humerus that flexes the elbow. (NCI)","C53149","BRACHIALIS MUSCLE","Brachialis","http://id.d4k.dk/dataset/cdisc/ct/v48/sdtm/C74456-C53149"
"4041","Innominate Artery","An artery of the mediastinum; in general it arises from the aortic arch and branches to form the right subclavian artery and one or both common carotid arteries.","C32814","BRACHIOCEPHALIC ARTERY","Innominate Artery","http://id.d4k.dk/dataset/cdisc/ct/v48/sdtm/C74456-C32814"
