"id","alt_label","definition","identifier","notation","pref_label","uri"
"6290","Carboxyhemoglobin/Total Hemoglobin","A relative measurement (ratio or percentage) of the amount of carboxyhemoglobin compared to total hemoglobin in a biological specimen.","C147355","HBCOHGB","Carboxyhemoglobin to Total Hemoglobin Ratio Measurement","http://id.d4k.dk/dataset/cdisc/ct/v48/sdtm/C65047-C147355"
"6291","Hemoglobin G Coushatta/Total Hemoglobin","A relative measurement (ratio or percentage) of the hemoglobin G Coushatta to total hemoglobin in a biological specimen.","C147356","HBGCHTHB","Hemoglobin G Coushatta to Total Hemoglobin Ratio Measurement","http://id.d4k.dk/dataset/cdisc/ct/v48/sdtm/C65047-C147356"
"6292","HBH Inclusion Bodies;Hemoglobin H Inclusion Bodies;HGH Inclusion Bodies","A measurement of the hemoglobin H inclusion bodies in a biological specimen.","C158234","HBHIB","Hemoglobin H Inclusion Bodies Measurement","http://id.d4k.dk/dataset/cdisc/ct/v48/sdtm/C65047-C158234"
"6293","Hemoglobin Lepore/Total Hemoglobin","A relative measurement (ratio or percentage) of the Lepore hemoglobin to total hemoglobin in a biological specimen.","C147357","HBLEPRHB","Hemoglobin Lepore to Total Hemoglobin Ratio Measurement","http://id.d4k.dk/dataset/cdisc/ct/v48/sdtm/C65047-C147357"
"6294","Hemoglobin O-Arab/Total Hemoglobin","A relative measurement (ratio or percentage) of the hemoglobin O-Arab to total hemoglobin in a biological specimen.","C147358","HBOARBHB","Hemoglobin O-Arab to Total Hemoglobin Ratio Measurement","http://id.d4k.dk/dataset/cdisc/ct/v48/sdtm/C65047-C147358"
"6295","FO2 Hb;Fractioned Oxyhemoglobin;Oxyhemoglobin/Total Hemoglobin","A relative measurement (ratio or percentage) of the amount of oxyhemoglobin compared to total hemoglobin in a biological specimen.","C147359","HBOXHGB","Oxyhemoglobin to Total Hemoglobin Ratio Measurement","http://id.d4k.dk/dataset/cdisc/ct/v48/sdtm/C65047-C147359"
"6296","Choriogonadotropin Beta;Pregnancy Test","A measurement of the Choriogonadotropin Beta in a biological specimen.","C64851","HCG","Choriogonadotropin Beta Measurement","http://id.d4k.dk/dataset/cdisc/ct/v48/sdtm/C65047-C64851"
"6297","Choriogonadotropin Beta, Free","A measurement of the free choriogonadotropin beta in a biological specimen.","C147360","HCGFR","Free Choriogonadotropin Beta Measurement","http://id.d4k.dk/dataset/cdisc/ct/v48/sdtm/C65047-C147360"
"6298","Choriogonadotropin","A measurement of the total choriogonadotropin in a biological specimen.","C147128","HCGND","Choriogonadotropin Measurement","http://id.d4k.dk/dataset/cdisc/ct/v48/sdtm/C65047-C147128"
"6299","Choriogonadotropin, Intact","A measurement of the intact choriogonadotropin in a biological specimen.","C147361","HCGNDI","Intact Choriogonadotropin Measurement","http://id.d4k.dk/dataset/cdisc/ct/v48/sdtm/C65047-C147361"
"6300","Hyocholate;Hyocholic Acid","A measurement of the hyocholate in a biological specimen.","C176300","HCHT","Hyocholate Measurement","http://id.d4k.dk/dataset/cdisc/ct/v48/sdtm/C65047-C176300"
"6301","3-HCOA;3-Hydroxy-5-cholestenoic acid;3beta-Hydroxy-5-Cholestenoic Acid","A measurement of the 3beta-hydroxy-5-cholestenoic acid in a biological specimen.","C181428","HCOA3","3beta-Hydroxy-5-Cholestenoic Acid Measurement","http://id.d4k.dk/dataset/cdisc/ct/v48/sdtm/C65047-C181428"
"6302","Erythrocyte Volume Fraction;EVF;Hematocrit;Packed Cell Volume;PCV","The percentage of a whole blood specimen that is composed of red blood cells (erythrocytes).","C64796","HCT","Hematocrit Measurement","http://id.d4k.dk/dataset/cdisc/ct/v48/sdtm/C65047-C64796"
"6303","HDL Cholesterol","A measurement of the high density lipoprotein cholesterol in a biological specimen.","C105587","HDL","High Density Lipoprotein Cholesterol Measurement","http://id.d4k.dk/dataset/cdisc/ct/v48/sdtm/C65047-C105587"
"6304","HDL-Cholesterol Subclass 2","A measurement of the high-density lipoprotein (HDL) cholesterol subclass 2 in a biological specimen.","C80187","HDL2","HDL-Cholesterol Subclass 2 Measurement","http://id.d4k.dk/dataset/cdisc/ct/v48/sdtm/C65047-C80187"
"6305","HDL-Cholesterol Subclass 3","A measurement of the high-density lipoprotein (HDL) cholesterol subclass 3 in a biological specimen.","C80188","HDL3","HDL-Cholesterol Subclass 3 Measurement","http://id.d4k.dk/dataset/cdisc/ct/v48/sdtm/C65047-C80188"
"6306","HDL Cholesterol/Total Cholesterol","A relative measurement (ratio or percentage) of the amount of HDL cholesterol compared to total cholesterol in a biological specimen.","C147362","HDLCCHOL","HDL Cholesterol to Total Cholesterol Ratio Measurement","http://id.d4k.dk/dataset/cdisc/ct/v48/sdtm/C65047-C147362"
"6307","HDL Cholesterol/LDL Cholesterol","A relative measurement (ratio or percentage) of the amount of HDL cholesterol compared to LDL cholesterol in a biological specimen.","C100425","HDLCLDLC","HDL Cholesterol to LDL Cholesterol Ratio Measurement","http://id.d4k.dk/dataset/cdisc/ct/v48/sdtm/C65047-C100425"
"6308","HDL Phospholipid;HDL-PL","A measurement of the high density lipoprotein phospholipid in a biological specimen.","C156513","HDLPL","HDL Phospholipid Measurement","http://id.d4k.dk/dataset/cdisc/ct/v48/sdtm/C65047-C156513"
"6309","HDL Particle Size","A measurement of the average particle size of high-density lipoprotein in a biological specimen.","C103402","HDLPSZ","HDL Particle Size Measurement","http://id.d4k.dk/dataset/cdisc/ct/v48/sdtm/C65047-C103402"
"6310","Hemoglobin Concentration Distribution Width;Hemoglobin Distribution Width","A measurement of the distribution of the hemoglobin concentration in red blood cells.","C106525","HDW","Hemoglobin Distribution Width Measurement","http://id.d4k.dk/dataset/cdisc/ct/v48/sdtm/C65047-C106525"
"6311","Ret Hemoglobin Distribution Width;Reticulocyte Hemoglobin Concentration Distribution Width","A measurement of the distribution of the hemoglobin concentration in reticulocytes.","C139070","HDWR","Reticulocyte Hemoglobin Distribution Width","http://id.d4k.dk/dataset/cdisc/ct/v48/sdtm/C65047-C139070"
"6312","Human Epididymis Protein 4","A measurement of the human epididymis protein 4 in a biological specimen.","C163452","HE4","Human Epididymis Protein 4 Measurement","http://id.d4k.dk/dataset/cdisc/ct/v48/sdtm/C65047-C163452"
"6313","Heinz Bodies;Heinz-Erhlich Bodies","A measurement of the Heinz bodies (small round inclusions within the body of a red blood cell) in a biological specimen.","C74709","HEINZ","Heinz-Ehrlich Body Measurement","http://id.d4k.dk/dataset/cdisc/ct/v48/sdtm/C65047-C74709"
"6314","Heinz Bodies/Erythrocytes","A relative measurement (ratio or percentage) of the erythrocytes that contain heinz bodies to total erythrocytes in a biological specimen.","C111206","HEINZRBC","Heinz Body to Erythrocyte Ratio Measurement","http://id.d4k.dk/dataset/cdisc/ct/v48/sdtm/C65047-C111206"
"6315","Helmet Cells","A measurement of the Helmet cells (specialized Keratocytes with two projections on either end that are tapered and hornlike) in a biological specimen.","C74658","HELMETCE","Helmet Cell Count","http://id.d4k.dk/dataset/cdisc/ct/v48/sdtm/C65047-C74658"
"6316","Helicase MOV-10 Protein;Moloney Leukemia Virus 10 Protein","A measurement of helicase MOV-10 protein in a biological specimen.","C165966","HELMOV10","Helicase MOV-10 Protein Measurement","http://id.d4k.dk/dataset/cdisc/ct/v48/sdtm/C65047-C165966"
"6317","Hemolysis;Hemolytic Index","A measurement of the destruction of red blood cells in a biological specimen.","C111208","HEMOLYSI","Hemolytic Index","http://id.d4k.dk/dataset/cdisc/ct/v48/sdtm/C65047-C111208"
"6318","Heparin","A measurement of the heparin in a biological specimen.","C165967","HEPARIN","Heparin Measurement","http://id.d4k.dk/dataset/cdisc/ct/v48/sdtm/C65047-C165967"
"6319","Hepcidin","A measurement of the total hepcidin in a biological specimen.","C174387","HEPCIDIN","Hepcidin Measurement","http://id.d4k.dk/dataset/cdisc/ct/v48/sdtm/C65047-C174387"
"6320","ERBB2;HER2/NEU;Human Epidermal Growth Factor Receptor 2","A measurement of HER2 protein in a biological specimen.","C112312","HER2","Human Epidermal Growth Factor Receptor 2 Measurement","http://id.d4k.dk/dataset/cdisc/ct/v48/sdtm/C65047-C112312"
"6321","HER2 Antigen;HER2/NEU Antigen;HER2/NEU Shed Antigen;Soluble HER2;Soluble HER2/NEU","A measurement of the soluble HER2 protein in a biological specimen.","C112291","HER2S","Soluble HER2 Antigen Measurement","http://id.d4k.dk/dataset/cdisc/ct/v48/sdtm/C65047-C112291"
"6322","E3 ISG15--Protein Ligase HERC5;HECT and RLD Domain Containing E3 Ubiquitin Protein Ligase 5;Hect Domain and RLD 5","A measurement of the hect domain and RLD 5 in a biological specimen.","C163453","HERC5","Hect Domain and RLD 5 Measurement","http://id.d4k.dk/dataset/cdisc/ct/v48/sdtm/C65047-C163453"
"6323","Heterophils","A measurement of heterophils (granular leukocytes) in a biological specimen from avian species.","C116186","HETRPH","Heterophil Measurement","http://id.d4k.dk/dataset/cdisc/ct/v48/sdtm/C65047-C116186"
"6324","Heterophils/Leukocytes","A relative measurement (ratio or percentage) of heterophils to leukocytes in a biological specimen from avian species.","C116187","HETRPHLE","Heterophils to Leukocytes Ratio Measurement","http://id.d4k.dk/dataset/cdisc/ct/v48/sdtm/C65047-C116187"
"6325","Beta-Hexosaminidase Subunit Alpha;Beta-N-Acetylhexosaminidase Subunit Alpha;Hexosaminidase A;Hexosaminidase Subunit A;Hexosaminidase Subunit Alpha;N-Acetyl-Beta-Glucosaminidase Subunit Alpha","A measurement of the hexosaminidase A in a biological specimen.","C181411","HEXA","Hexosaminidase A Measurement","http://id.d4k.dk/dataset/cdisc/ct/v48/sdtm/C65047-C181411"
"6326","Hexokinase","A measurement of the hexokinase in a biological specimen.","C96668","HEXK","Hexokinase Measurement","http://id.d4k.dk/dataset/cdisc/ct/v48/sdtm/C65047-C96668"
"6327","Hemoglobin;Hemoglobin Monomer","A measurement of the total erythrocyte associated hemoglobin in a biological specimen.","C64848","HGB","Hemoglobin Measurement","http://id.d4k.dk/dataset/cdisc/ct/v48/sdtm/C65047-C64848"
"6328","Hemoglobin A","A measurement of the hemoglobin A in a biological specimen.","C92258","HGBA","Hemoglobin A Measurement","http://id.d4k.dk/dataset/cdisc/ct/v48/sdtm/C65047-C92258"
"6329","Hemoglobin A1/Total Hemoglobin","A relative measurement (ratio or percentage) of the hemoglobin A1 to total hemoglobin in a biological specimen.","C147363","HGBA1HGB","Hemoglobin A1 to Total Hemoglobin Ratio Measurement","http://id.d4k.dk/dataset/cdisc/ct/v48/sdtm/C65047-C147363"
"6330","Hemoglobin A2","A measurement of the hemoglobin A2 in a biological specimen.","C92259","HGBA2","Hemoglobin A2 Measurement","http://id.d4k.dk/dataset/cdisc/ct/v48/sdtm/C65047-C92259"
"6331","Hemoglobin A2/Total Hemoglobin","A relative measurement (ratio or percentage) of the hemoglobin A2 to total hemoglobin in a biological specimen.","C81277","HGBA2HGB","Hemoglobin A2 to Total Hemoglobin Ratio Measurement","http://id.d4k.dk/dataset/cdisc/ct/v48/sdtm/C65047-C81277"
"6332","Hemoglobin A/Total Hemoglobin","A relative measurement (ratio or percentage) of the hemoglobin A to total hemoglobin in a biological specimen.","C81276","HGBAHGB","Hemoglobin A to Total Hemoglobin Ratio Measurement","http://id.d4k.dk/dataset/cdisc/ct/v48/sdtm/C65047-C81276"
"6333","Hemoglobin B","A measurement of the hemoglobin B in a biological specimen.","C92260","HGBB","Hemoglobin B Measurement","http://id.d4k.dk/dataset/cdisc/ct/v48/sdtm/C65047-C92260"
"6334","Hemoglobin C","A measurement of the hemoglobin C in a biological specimen.","C92261","HGBC","Hemoglobin C Measurement","http://id.d4k.dk/dataset/cdisc/ct/v48/sdtm/C65047-C92261"
"6335","Hemoglobin C/Total Hemoglobin","A relative measurement (ratio or percentage) of the hemoglobin C to total hemoglobin in a biological specimen.","C81278","HGBCHGB","Hemoglobin C to Total Hemoglobin Ratio Measurement","http://id.d4k.dk/dataset/cdisc/ct/v48/sdtm/C65047-C81278"
"6336","Hemoglobin Casts","A measurement of the hemoglobin casts present in a biological specimen.","C156515","HGBCS","Hemoglobin Cast Measurement","http://id.d4k.dk/dataset/cdisc/ct/v48/sdtm/C65047-C156515"
"6337","Hemoglobin D/Total Hemoglobin","A relative measurement (ratio or percentage) of the hemoglobin D to total hemoglobin in a biological specimen.","C147364","HGBDHGB","Hemoglobin D to Total Hemoglobin Ratio Measurement","http://id.d4k.dk/dataset/cdisc/ct/v48/sdtm/C65047-C147364"
"6338","Deoxyhemoglobin","A measurement of the deoxyhemoglobin, hemoglobin without oxygen, in a biological specimen.","C124343","HGBDOXY","Deoxyhemoglobin Measurement","http://id.d4k.dk/dataset/cdisc/ct/v48/sdtm/C65047-C124343"
"6339","Hemoglobin E/Total Hemoglobin","A relative measurement (ratio or percentage) of the hemoglobin E to total hemoglobin in a biological specimen.","C147365","HGBEHGB","Hemoglobin E to Total Hemoglobin Ratio Measurement","http://id.d4k.dk/dataset/cdisc/ct/v48/sdtm/C65047-C147365"
"6340","Fetal Hemoglobin;Hemoglobin F","A measurement of the hemoglobin F in a biological specimen.","C92262","HGBF","Hemoglobin F Measurement","http://id.d4k.dk/dataset/cdisc/ct/v48/sdtm/C65047-C92262"
"6341","Hemoglobin F/Total Hemoglobin","A relative measurement (ratio or percentage) of the fetal hemoglobin (hemoglobin F) to total hemoglobin in a biological specimen.","C147366","HGBFHGB","Hemoglobin F to Total Hemoglobin Ratio Measurement","http://id.d4k.dk/dataset/cdisc/ct/v48/sdtm/C65047-C147366"
"6342","Hemoglobin Fraction Pattern","A description of the hemoglobin fraction pattern in a biological specimen.","C161363","HGBFPATN","Hemoglobin Fraction Pattern","http://id.d4k.dk/dataset/cdisc/ct/v48/sdtm/C65047-C161363"
"6343","Hemoglobin, Free","A measurement of the hemoglobin external to erythrocytes in a biological specimen.","C127617","HGBFR","Free Hemoglobin Measurement","http://id.d4k.dk/dataset/cdisc/ct/v48/sdtm/C65047-C127617"
"6344","Methemoglobin","A measurement of the methemoglobin in a biological specimen.","C96689","HGBMET","Methemoglobin Measurement","http://id.d4k.dk/dataset/cdisc/ct/v48/sdtm/C65047-C96689"
"6345","FMET HB;Fractionated Methemoglobin;Methemoglobin/Total Hemoglobin","A relative measurement (ratio or percentage) of the amount of methemoglobin compared to total hemoglobin in a biological specimen.","C147367","HGBMHGB","Methemoglobin to Total Hemoglobin Ratio Measurement","http://id.d4k.dk/dataset/cdisc/ct/v48/sdtm/C65047-C147367"
"6346","Oxyhemoglobin","A measurement of the oxyhemoglobin, oxygen-bound hemoglobin, in a biological specimen.","C96616","HGBOXY","Oxyhemoglobin Measurement","http://id.d4k.dk/dataset/cdisc/ct/v48/sdtm/C65047-C96616"
"6347","Hemoglobin S;Sickle Hemoglobin","A measurement of the hemoglobin S in a biological specimen.","C122123","HGBS","Hemoglobin S Measurement","http://id.d4k.dk/dataset/cdisc/ct/v48/sdtm/C65047-C122123"
"6348","Hemoglobin S/Total Hemoglobin","A relative measurement (ratio or percentage) of the hemoglobin S to total hemoglobin in a biological specimen.","C81279","HGBSHGB","Hemoglobin S to Total Hemoglobin Ratio Measurement","http://id.d4k.dk/dataset/cdisc/ct/v48/sdtm/C65047-C81279"
"6349","Hemoglobin Tetramer","A measurement of the hemoglobin tetramer in a biological specimen.","C135425","HGBTET","Hemoglobin Tetramer Measurement","http://id.d4k.dk/dataset/cdisc/ct/v48/sdtm/C65047-C135425"
"6350","Hepatocyte Growth Factor","A measurement of the hepatocyte growth factor in a biological specimen.","C135426","HGF","Hepatocyte Growth Factor Measurement","http://id.d4k.dk/dataset/cdisc/ct/v48/sdtm/C65047-C135426"
"6351","c-Met;Hepatocyte Growth Factor Receptor;MET Proto-Oncogene, Receptor Tyrosine Kinase;Tyrosine-Protein Kinase Met","A measurement of the hepatocyte growth factor receptor in a biological specimen.","C172514","HGFR","Hepatocyte Growth Factor Receptor Measurement","http://id.d4k.dk/dataset/cdisc/ct/v48/sdtm/C65047-C172514"
"6352","Hepatocyte Growth Factor Receptor, Free","A measurement of the free (unbound) hepatocyte growth factor receptor in a biological specimen.","C181453","HGFRFR","Free Hepatocyte Growth Factor Receptor Measurement","http://id.d4k.dk/dataset/cdisc/ct/v48/sdtm/C65047-C181453"
"6353","Histidine","A measurement of the histidine in a biological specimen.","C122124","HIS","Histidine Measurement","http://id.d4k.dk/dataset/cdisc/ct/v48/sdtm/C65047-C122124"
"6354","Histone 1 Antibody","A measurement of the total histone 1 antibodies in a biological specimen.","C112293","HIST1AB","Histone 1 Antibody Measurement","http://id.d4k.dk/dataset/cdisc/ct/v48/sdtm/C65047-C112293"
"6355","Histone 2A Antibody","A measurement of the total histone 2A antibodies in a biological specimen.","C112294","HIST2AAB","Histone 2A Antibody Measurement","http://id.d4k.dk/dataset/cdisc/ct/v48/sdtm/C65047-C112294"
"6356","Histone 2B Antibody","A measurement of the total histone 2B antibodies in a biological specimen.","C112295","HIST2BAB","Histone 2B Antibody Measurement","http://id.d4k.dk/dataset/cdisc/ct/v48/sdtm/C65047-C112295"
"6357","Histone 3 Antibody","A measurement of the total histone 3 antibodies in a biological specimen.","C112296","HIST3AB","Histone 3 Antibody Measurement","http://id.d4k.dk/dataset/cdisc/ct/v48/sdtm/C65047-C112296"
"6358","Histone 4 Antibody","A measurement of the total histone 4 antibodies in a biological specimen.","C112297","HIST4AB","Histone 4 Antibody Measurement","http://id.d4k.dk/dataset/cdisc/ct/v48/sdtm/C65047-C112297"
"6359","Anti-Histone Antibodies;Histone Antibodies","A measurement of histone antibodies in a biological specimen.","C111209","HISTAB","Histone Antibody Measurement","http://id.d4k.dk/dataset/cdisc/ct/v48/sdtm/C65047-C111209"
"6360","Histamine","A measurement of the histamine in a biological specimen.","C80189","HISTAMIN","Histamine Measurement","http://id.d4k.dk/dataset/cdisc/ct/v48/sdtm/C65047-C80189"
"6361","HLA Class IA Antigen","A measurement of the HLA class IA antigen in a biological specimen.","C154746","HLAA","HLA Class IA Histocompatibility Antigen Measurement","http://id.d4k.dk/dataset/cdisc/ct/v48/sdtm/C65047-C154746"
"6362","HLA A03 Antigen;HLA-A03 Antigen","A measurement of the HLA A03 antigen in a biological specimen.","C181440","HLAA03","HLA A03 Histocompatibility Antigen Measurement","http://id.d4k.dk/dataset/cdisc/ct/v48/sdtm/C65047-C181440"
"6363","HLA A2 Antigen;HLA-A2 Antigen","A measurement of the HLA A2 antigen in a biological specimen.","C181441","HLAA2","HLA A2 Histocompatibility Antigen Measurement","http://id.d4k.dk/dataset/cdisc/ct/v48/sdtm/C65047-C181441"
"6364","HLA-A23 Antibody","A measurement of the human leukocyte antigen A23 (HLA-A23) antibody in a biological specimen.","C128953","HLAA23A","HLA-A23 Antibody Measurement","http://id.d4k.dk/dataset/cdisc/ct/v48/sdtm/C65047-C128953"
"6365","HLA A24 Antigen;HLA-A24 Antigen","A measurement of the HLA A24 antigen in a biological specimen.","C181442","HLAA24","HLA A24 Histocompatibility Antigen Measurement","http://id.d4k.dk/dataset/cdisc/ct/v48/sdtm/C65047-C181442"
"6366","HLA-A2 Antibody","A measurement of the human leukocyte antigen A2 (HLA-A2) antibody in a biological specimen.","C128954","HLAA2AB","HLA-A2 Antibody Measurement","http://id.d4k.dk/dataset/cdisc/ct/v48/sdtm/C65047-C128954"
"6367","HLA A3 Antigen;HLA-A3 Antigen","A measurement of the HLA A3 antigen in a biological specimen.","C181443","HLAA3","HLA A3 Histocompatibility Antigen Measurement","http://id.d4k.dk/dataset/cdisc/ct/v48/sdtm/C65047-C181443"
"6368","HLA-A Antigen Type","The identification of the type of human leukocyte antigen, class I, group A (HLA-A), in a biological specimen.","C128955","HLAAAGT","HLA-A Antigen Type","http://id.d4k.dk/dataset/cdisc/ct/v48/sdtm/C65047-C128955"
"6369","HLA-A Mismatch Count","A measurement to determine the number of mismatches between the recipient and the donor for the human leukocyte antigen, class I, group A (HLA-A).","C128956","HLAAMSC","HLA-A Mismatch Count","http://id.d4k.dk/dataset/cdisc/ct/v48/sdtm/C65047-C128956"
"6370","HLA Class IB Antigen","A measurement of the HLA class IB antigen in a biological specimen.","C154747","HLAB","HLA Class IB Histocompatibility Antigen Measurement","http://id.d4k.dk/dataset/cdisc/ct/v48/sdtm/C65047-C154747"
"6371","HLA-B27 Antigen;Human Leukocyte Antigen B27","A measurement of the human leukocyte antigen B27 (HLA-B27) in a biological specimen.","C100460","HLAB27AG","HLA-B27 Antigen Measurement","http://id.d4k.dk/dataset/cdisc/ct/v48/sdtm/C65047-C100460"
"6372","HLA-B Antigen Type","The identification of the type of human leukocyte antigen, class I, group B (HLA-B), in a biological specimen.","C128957","HLABAGT","HLA-B Antigen Type","http://id.d4k.dk/dataset/cdisc/ct/v48/sdtm/C65047-C128957"
"6373","HLA-B Mismatch Count","A measurement to determine the number of mismatches between the recipient and the donor for the human leukocyte antigen, class I, group B (HLA-B).","C128958","HLABMSC","HLA-B Mismatch Count","http://id.d4k.dk/dataset/cdisc/ct/v48/sdtm/C65047-C128958"
"6374","HLA Class IC Antigen","A measurement of the HLA class IC antigen in a biological specimen.","C154748","HLAC","HLA Class IC Histocompatibility Antigen Measurement","http://id.d4k.dk/dataset/cdisc/ct/v48/sdtm/C65047-C154748"
"6375","HLA Cw Antigen;HLA-Cw Antigen","A measurement of the HLA Cw antigen in a biological specimen.","C181439","HLACW","HLA Cw Histocompatibility Antigen Measurement","http://id.d4k.dk/dataset/cdisc/ct/v48/sdtm/C65047-C181439"
"6376","HLA DP Alpha1 Antigen;HLA-DP Alpha1 Antigen","A measurement of the HLA DP alpha1 antigen in a biological specimen.","C181417","HLADPA1","HLA DP Alpha1 Histocompatibility Antigen Measurement","http://id.d4k.dk/dataset/cdisc/ct/v48/sdtm/C65047-C181417"
"6377","HLA DP Beta Antigen;HLA-DP Beta Antigen","A measurement of the total HLA DP beta antigen in a biological specimen.","C181444","HLADPB","HLA DP Beta Histocompatibility Antigen Measurement","http://id.d4k.dk/dataset/cdisc/ct/v48/sdtm/C65047-C181444"
"6378","HLA DP Beta1 Antigen","A measurement of the HLA DP beta1 antigen in a biological specimen.","C154751","HLADPB1","HLA DP Beta1 Histocompatibility Antigen Measurement","http://id.d4k.dk/dataset/cdisc/ct/v48/sdtm/C65047-C154751"
"6379","HLA DQ Alpha1 Antigen;HLA-DQ Alpha1 Antigen","A measurement of the HLA DQ alpha1 antigen in a biological specimen.","C181416","HLADQA1","HLA DQ Alpha1 Histocompatibility Antigen Measurement","http://id.d4k.dk/dataset/cdisc/ct/v48/sdtm/C65047-C181416"
"6380","HLA DQ Beta1 Antigen","A measurement of the HLA DQ beta1 antigen in a biological specimen.","C154750","HLADQB1","HLA DQ Beta1 Histocompatibility Antigen Measurement","http://id.d4k.dk/dataset/cdisc/ct/v48/sdtm/C65047-C154750"
"6381","HLA DR Antigen;HLA-DR Antigen","A measurement of the total HLA DR antigen in a biological specimen.","C176962","HLADR","HLA DR Histocompatibility Antigen Measurement","http://id.d4k.dk/dataset/cdisc/ct/v48/sdtm/C65047-C176962"
"6382","HLA-DR51 Antibody","A measurement of the human leukocyte antigen DR51 (HLA-DR51) antibody in a biological specimen.","C128959","HLADR51A","HLA-DR51 Antibody Measurement","http://id.d4k.dk/dataset/cdisc/ct/v48/sdtm/C65047-C128959"
"6383","HLA-DR52 Antibody","A measurement of the human leukocyte antigen DR52 (HLA-DR52) antibody in a biological specimen.","C128960","HLADR52A","HLA-DR52 Antibody Measurement","http://id.d4k.dk/dataset/cdisc/ct/v48/sdtm/C65047-C128960"
"6384","HLA-DR53 Antibody","A measurement of the human leukocyte antigen DR53 (HLA-DR53) antibody in a biological specimen.","C128961","HLADR53A","HLA-DR53 Antibody Measurement","http://id.d4k.dk/dataset/cdisc/ct/v48/sdtm/C65047-C128961"
"6385","HLA-DR Antigen Type","The identification of the type of human leukocyte antigen, class II, antigen-D-related (HLA-DR), in a biological specimen.","C128962","HLADRAGT","HLA-DR Antigen Type","http://id.d4k.dk/dataset/cdisc/ct/v48/sdtm/C65047-C128962"
"6386","HLA DR Beta Antigen;HLA-DR Beta Antigen","A measurement of the total HLA DR beta antigen in a biological specimen.","C181192","HLADRB","HLA DR Beta Histocompatibility Antigen Measurement","http://id.d4k.dk/dataset/cdisc/ct/v48/sdtm/C65047-C181192"
"6387","HLA DR Beta1 Antigen","A measurement of the HLA DR beta1 antigen in a biological specimen.","C154749","HLADRB1","HLA DR Beta1 Histocompatibility Antigen Measurement","http://id.d4k.dk/dataset/cdisc/ct/v48/sdtm/C65047-C154749"
"6388","HLA DR Beta2 Antigen;HLA-DR Beta2 Antigen","A measurement of the HLA DR beta2 antigen in a biological specimen.","C181415","HLADRB2","HLA DR Beta 2 Histocompatibility Antigen Measurement","http://id.d4k.dk/dataset/cdisc/ct/v48/sdtm/C65047-C181415"
"6389","HLA DR Beta3 Antigen;HLA-DR Beta3 Antigen","A measurement of the HLA DR beta3 antigen in a biological specimen.","C181412","HLADRB3","HLA DR Beta 3 Histocompatibility Antigen Measurement","http://id.d4k.dk/dataset/cdisc/ct/v48/sdtm/C65047-C181412"
"6390","HLA DR Beta4 Antigen;HLA-DR Beta4 Antigen","A measurement of the HLA DR beta4 antigen in a biological specimen.","C181413","HLADRB4","HLA DR Beta 4 Histocompatibility Antigen Measurement","http://id.d4k.dk/dataset/cdisc/ct/v48/sdtm/C65047-C181413"
"6391","HLA DR Beta5 Antigen;HLA-DR Beta5 Antigen","A measurement of the HLA DR beta5 antigen in a biological specimen.","C181414","HLADRB5","HLA DR Beta 5 Histocompatibility Antigen Measurement","http://id.d4k.dk/dataset/cdisc/ct/v48/sdtm/C65047-C181414"
"6392","HLA-DR Mismatch Count","A measurement to determine the number of mismatches between the recipient and the donor for the human leukocyte antigen, class II, antigen-D-related (HLA-DR).","C128963","HLADRMSC","HLA-DR Mismatch Count","http://id.d4k.dk/dataset/cdisc/ct/v48/sdtm/C65047-C128963"
"6393","HLA Class I Antibody","A measurement of the human leukocyte antigen (HLA) antibody class I in a biological specimen.","C128964","HLAIAB","HLA Class I Antibody Measurement","http://id.d4k.dk/dataset/cdisc/ct/v48/sdtm/C65047-C128964"
