"id","alt_label","definition","identifier","notation","pref_label","uri"
"5773","CK, Macromolecular Type 2/Total CK;Creatine Kinase, Macromolecular Type 2/Total Creatine Kinase","A relative measurement (ratio or percentage) of the macromolecular type 2 creatine kinase to total creatine kinase in a biological specimen.","C147320","CKMT2CK","Macromolecular Type 2 Creatine Kinase to Total Creatine Kinase Ratio Measurement","http://id.d4k.dk/dataset/cdisc/ct/v48/sdtm/C65047-C147320"
"5774","Chloride","A measurement of the chloride in a biological specimen.","C64495","CL","Chloride Measurement","http://id.d4k.dk/dataset/cdisc/ct/v48/sdtm/C65047-C64495"
"5775","Clarity","A measurement of the transparency of a biological specimen.","C96594","CLARITY","Clarity Measurement","http://id.d4k.dk/dataset/cdisc/ct/v48/sdtm/C65047-C96594"
"5776","Chloride Clearance","A measurement of the volume of serum or plasma that would be cleared of chloride by excretion of urine for a specified unit of time (e.g. one minute).","C106509","CLCLR","Chloride Clearance Measurement","http://id.d4k.dk/dataset/cdisc/ct/v48/sdtm/C65047-C106509"
"5777","Chloride/Creatinine","A relative measurement (ratio or percentage) of the chloride to creatinine in a biological specimen.","C79440","CLCREAT","Chloride to Creatinine Ratio Measurement","http://id.d4k.dk/dataset/cdisc/ct/v48/sdtm/C65047-C79440"
"5778","Calcitonin","A measurement of the calcitonin hormone in a biological specimen.","C74848","CLCTONN","Calcitonin Measurement","http://id.d4k.dk/dataset/cdisc/ct/v48/sdtm/C65047-C74848"
"5779","Calcitriol","A measurement of the calcitriol hormone in a biological specimen.","C74849","CLCTRIOL","Calcitriol Measurement","http://id.d4k.dk/dataset/cdisc/ct/v48/sdtm/C65047-C74849"
"5780","Columnar Epi Cells/Non-Squam Epi Cells","A relative measurement (ratio or percentage) of the columnar epithelial cells to non-squamous epithelial cells in a biological specimen.","C135405","CLEPNSQE","Columnar Epithelial Cells to Non-Squamous Epithelial Cells Ratio Measurement","http://id.d4k.dk/dataset/cdisc/ct/v48/sdtm/C65047-C135405"
"5781","Chloride Excretion Rate","A measurement of the amount of chloride being excreted in a biological specimen over a defined period of time (e.g. one hour).","C150816","CLEXR","Chloride Excretion Rate","http://id.d4k.dk/dataset/cdisc/ct/v48/sdtm/C65047-C150816"
"5782","Clonazepam","A measurement of the clonazepam present in a biological specimen.","C139082","CLNZPM","Clonazepam Measurement","http://id.d4k.dk/dataset/cdisc/ct/v48/sdtm/C65047-C139082"
"5783","cloBAZam;Clobazam","A measurement of the clobazam in a biological specimen.","C184613","CLOBAZAM","Clobazam Measurement","http://id.d4k.dk/dataset/cdisc/ct/v48/sdtm/C65047-C184613"
"5784","Clostebol","A measurement of the clostebol in a biological specimen.","C184581","CLOSTBL","Clostebol Measurement","http://id.d4k.dk/dataset/cdisc/ct/v48/sdtm/C65047-C184581"
"5785","Clot Retraction;Clot Retraction, Qualitative","A qualitative assessment of clot retraction in a biological specimen.","C181438","CLOTRTC","Qualitative Clot Retraction Measurement","http://id.d4k.dk/dataset/cdisc/ct/v48/sdtm/C65047-C181438"
"5786","Clot Retraction Time","A measurement of the amount of time it takes for a clot to retract, or pull away from, the wall of a glass collection container.","C181437","CLOTRTCT","Clot Retraction Time Measurement","http://id.d4k.dk/dataset/cdisc/ct/v48/sdtm/C65047-C181437"
"5787","Chlorphentermine","A measurement of the chlorphentermine in a biological specimen.","C184580","CLPHTRMN","Chlorphentermine Measurement","http://id.d4k.dk/dataset/cdisc/ct/v48/sdtm/C65047-C184580"
"5788","Chlordiazepoxide","A measurement of the chlordiazepoxide present in a biological specimen.","C75371","CLRDZPXD","Chlordiazepoxide Measurement","http://id.d4k.dk/dataset/cdisc/ct/v48/sdtm/C65047-C75371"
"5789","Clorazepate","A measurement of the clorazepate present in a biological specimen.","C139077","CLRZPT","Clorazepate Measurement","http://id.d4k.dk/dataset/cdisc/ct/v48/sdtm/C65047-C139077"
"5790","Clue Cells","A measurement of the clue cells in a biological specimen.","C102261","CLUECE","Clue Cell Count","http://id.d4k.dk/dataset/cdisc/ct/v48/sdtm/C65047-C102261"
"5791","Carbon Monoxide","A measurement of the carbon monoxide in a biological specimen.","C139084","CMONOX","Carbon Monoxide Measurement","http://id.d4k.dk/dataset/cdisc/ct/v48/sdtm/C65047-C139084"
"5792","Cytidine-Uridine Monophosphate Kinase 2;Cytidine/Uridine Monophosphate Kinase 2","A measurement of the cytidine-uridine monophosphate kinase 2 in a biological specimen.","C163426","CMPK2","Cytidine-Uridine Monophosphate Kinase 2 Measurement","http://id.d4k.dk/dataset/cdisc/ct/v48/sdtm/C65047-C163426"
"5793","Centromere IgG Antibody;Centromere Protein B","A measurement of the centromere IgG antibody in a biological specimen.","C122111","CNTIGGAB","Centromere IgG Antibody Measurement","http://id.d4k.dk/dataset/cdisc/ct/v48/sdtm/C65047-C122111"
"5794","Carbon Dioxide","A measurement of the carbon dioxide gas in a biological specimen.","C64545","CO2","Carbon Dioxide Measurement","http://id.d4k.dk/dataset/cdisc/ct/v48/sdtm/C65047-C64545"
"5795","CI;Coagulation Index","A measurement of the efficiency of coagulation of a biological specimen. This is calculated by a mathematical formula that takes into account the R value, K value, angle and maximum amplitude of clot formation.","C112239","COAGIDX","Coagulation Index Measurement","http://id.d4k.dk/dataset/cdisc/ct/v48/sdtm/C65047-C112239"
"5796","Cocaine and/or Metabolites","A measurement of the cocaine and/or its metabolite(s) present in a biological specimen, for an assay that can measure both cocaine and its metabolites.","C172490","COCAAOM","Cocaine And/Or Metabolites Measurement","http://id.d4k.dk/dataset/cdisc/ct/v48/sdtm/C65047-C172490"
"5797","Cocaethylene;Cocaine Ethyl","A measurement of the cocaethylene present in a biological specimen.","C156510","COCAETH","Cocaethylene Measurement","http://id.d4k.dk/dataset/cdisc/ct/v48/sdtm/C65047-C156510"
"5798","Cocaine","A measurement of the cocaine present in a biological specimen.","C74690","COCAINE","Cocaine Measurement","http://id.d4k.dk/dataset/cdisc/ct/v48/sdtm/C65047-C74690"
"5799","Cocaine Metabolites","A measurement of any cocaine drug class metabolite(s) present in a biological specimen.","C172491","COCAM","Cocaine Metabolites Measurement","http://id.d4k.dk/dataset/cdisc/ct/v48/sdtm/C65047-C172491"
"5800","Cocaine Benzoylecgonine Ecgonine","A measurement of the cocaine, benzoylecgonine, and/or ecgonine in a biological specimen.","C142274","COCBNZEC","Cocaine, Benzoylecgonine, and/or Ecgonine Measurement","http://id.d4k.dk/dataset/cdisc/ct/v48/sdtm/C65047-C142274"
"5801","Codeine","A measurement of the codeine present in a biological specimen.","C74877","CODEINE","Codeine Measurement","http://id.d4k.dk/dataset/cdisc/ct/v48/sdtm/C65047-C74877"
"5802","Collagen Type IV","A measurement of the collagen type IV in a biological specimen.","C103383","COL4","Collagen Type IV Measurement","http://id.d4k.dk/dataset/cdisc/ct/v48/sdtm/C65047-C103383"
"5803","Color","A measurement of the color of a biological specimen.","C64546","COLOR","Color Assessment","http://id.d4k.dk/dataset/cdisc/ct/v48/sdtm/C65047-C64546"
"5804","Cartilage Oligomeric Matrix Protein","A measurement of the cartilage oligomeric matrix protein in a biological specimen.","C111145","COMP","Cartilage Oligomeric Matrix Protein Measurement","http://id.d4k.dk/dataset/cdisc/ct/v48/sdtm/C65047-C111145"
"5805","Urine Conductivity","A measurement of the urine conductivity which is a non-linear function of the electrolyte concentration in the urine.","C102282","CONDUCTU","Urine Conductivity","http://id.d4k.dk/dataset/cdisc/ct/v48/sdtm/C65047-C102282"
"5806","Consistency","A description about the firmness or make-up of an entity.","C95110","CONSIST","Consistency","http://id.d4k.dk/dataset/cdisc/ct/v48/sdtm/C65047-C95110"
"5807","Copeptin","A measurement of the copeptin in a biological specimen.","C127612","COPEP","Copeptin Measurement","http://id.d4k.dk/dataset/cdisc/ct/v48/sdtm/C65047-C127612"
"5808","Copper;Cu","A measurement of copper in a biological specimen.","C111161","COPPER","Copper Measurement","http://id.d4k.dk/dataset/cdisc/ct/v48/sdtm/C65047-C111161"
"5809","Coenzyme Q10;Ubiquinone 10","A measurement of the ubiquinone 10 in a biological specimen.","C147321","COQ10","Ubiquinone 10 Measurement","http://id.d4k.dk/dataset/cdisc/ct/v48/sdtm/C65047-C147321"
"5810","Cortisol/Creatinine","A relative measurement (ratio or percentage) of the cortisol to creatinine present in a sample.","C106512","CORCREAT","Cortisol to Creatinine Ratio Measurement","http://id.d4k.dk/dataset/cdisc/ct/v48/sdtm/C65047-C106512"
"5811","Cortisol, Free","A measurement of the free, unbound cortisol in a biological specimen.","C88113","CORTFR","Free Cortisol Measurement","http://id.d4k.dk/dataset/cdisc/ct/v48/sdtm/C65047-C88113"
"5812","Cortisol;Total Cortisol","A measurement of the cortisol in a biological specimen.","C74781","CORTISOL","Cortisol Measurement","http://id.d4k.dk/dataset/cdisc/ct/v48/sdtm/C65047-C74781"
"5813","Cotinine","A measurement of the cotinine in a biological specimen.","C92249","COTININE","Cotinine Measurement","http://id.d4k.dk/dataset/cdisc/ct/v48/sdtm/C65047-C92249"
"5814","Carboxypeptidase B2;CPU;PCPB;TAFI","A measurement of the carboxypeptidase B2 in a biological specimen.","C165953","CPB2","Carboxypeptidase B2 Measurement","http://id.d4k.dk/dataset/cdisc/ct/v48/sdtm/C65047-C165953"
"5815","C-peptide/Creatinine","A relative measurement (ratio or percentage) of the C-peptide to creatinine in a biological specimen.","C150837","CPEPCRT","C-peptide to Creatinine Ratio Measurement","http://id.d4k.dk/dataset/cdisc/ct/v48/sdtm/C65047-C150837"
"5816","C-peptide","A measurement of the C (connecting) peptide of insulin in a biological specimen.","C74736","CPEPTIDE","C-peptide Measurement","http://id.d4k.dk/dataset/cdisc/ct/v48/sdtm/C65047-C74736"
"5817","Carbamazepine","A measurement of the carbamazepine in a biological specimen.","C147322","CRBMZPN","Carbamazepine Measurement","http://id.d4k.dk/dataset/cdisc/ct/v48/sdtm/C65047-C147322"
"5818","Cardiolipin IgA Antibody","A measurement of the cardiolipin IgA antibody in a biological specimen.","C122112","CRDIGAAB","Cardiolipin IgA Antibody Measurement","http://id.d4k.dk/dataset/cdisc/ct/v48/sdtm/C65047-C122112"
"5819","Anti-Cardiolipin IgG Antibody;Cardiolipin IgG Antibody","A measurement of the cardiolipin IgG antibody in a biological specimen.","C111144","CRDIGGAB","Cardiolipin IgG Antibody Measurement","http://id.d4k.dk/dataset/cdisc/ct/v48/sdtm/C65047-C111144"
"5820","Cardiolipin IgM Antibody","A measurement of the cardiolipin IgM antibodies in a biological specimen.","C103363","CRDIGMAB","Cardiolipin IgM Antibody Measurement","http://id.d4k.dk/dataset/cdisc/ct/v48/sdtm/C65047-C103363"
"5821","Creatinine","A measurement of the creatinine in a biological specimen.","C64547","CREAT","Creatinine Measurement","http://id.d4k.dk/dataset/cdisc/ct/v48/sdtm/C65047-C64547"
"5822","Creatinine Clearance","A measurement of the volume of serum or plasma that would be cleared of creatinine by excretion of urine for a specified unit of time (e.g. one minute).","C25747","CREATCLR","Creatinine Clearance","http://id.d4k.dk/dataset/cdisc/ct/v48/sdtm/C65047-C25747"
"5823","Creatinine Excretion Rate","A measurement of the amount of creatinine being excreted in a biological specimen over a defined amount of time (e.g. one hour).","C150817","CREATEXR","Creatinine Excretion Rate","http://id.d4k.dk/dataset/cdisc/ct/v48/sdtm/C65047-C150817"
"5824","Crenated Cells","A measurement of the crenated cells in a biological specimen.","C74703","CRENCE","Crenated Cell Measurement","http://id.d4k.dk/dataset/cdisc/ct/v48/sdtm/C65047-C74703"
"5825","Corticotropin Releasing Factor;Corticotropin Releasing Hormone","A measurement of the corticotropin releasing hormone in a biological specimen.","C74851","CRH","Corticotropin Releasing Hormone Measurement","http://id.d4k.dk/dataset/cdisc/ct/v48/sdtm/C65047-C74851"
"5826","Caeruloplasmin;Ceruloplasmin","A measurement of ceruloplasmin in a biological specimen.","C100432","CRLPLSMN","Ceruloplasmin Measurement","http://id.d4k.dk/dataset/cdisc/ct/v48/sdtm/C65047-C100432"
"5827","Carnitine Esters","A measurement of the total carnitine esters in a biological specimen.","C147323","CRNTESTR","Carnitine Ester Measurement","http://id.d4k.dk/dataset/cdisc/ct/v48/sdtm/C65047-C147323"
"5828","C Reactive Protein","A measurement of the C reactive protein in a biological specimen.","C64548","CRP","C-Reactive Protein Measurement","http://id.d4k.dk/dataset/cdisc/ct/v48/sdtm/C65047-C64548"
"5829","Carisoprodol","A measurement of the carisoprodol in a biological specimen.","C184611","CRSPRDL","Carisoprodol Measurement","http://id.d4k.dk/dataset/cdisc/ct/v48/sdtm/C65047-C184611"
"5830","Creatinine Clearance Adjusted for BSA","A measurement of the volume of serum or plasma that would be cleared of creatinine by excretion of urine for a specified unit of time (e.g. one minute), adjusted for body surface area.","C147324","CRTCLRBS","Creatinine Clearance Adjusted for BSA","http://id.d4k.dk/dataset/cdisc/ct/v48/sdtm/C65047-C147324"
"5831","Creatinine Clearance, Estimated","An estimate of the volume of serum or plasma that would be cleared of creatinine by excretion of urine for a specified unit of time (e.g. one minute).","C150847","CRTCLRE","Estimated Creatinine Clearance","http://id.d4k.dk/dataset/cdisc/ct/v48/sdtm/C65047-C150847"
"5832","Corticosterone/Creatinine","A relative measurement (ratio or percentage) of the corticosterone to creatinine present in a sample.","C106511","CRTCREAT","Corticosterone to Creatinine Ratio Measurement","http://id.d4k.dk/dataset/cdisc/ct/v48/sdtm/C65047-C106511"
"5833","Cortisol, Free Excretion Rate","A measurement of the amount of free cortisol being excreted in a biological specimen over a defined amount of time (e.g. one hour).","C163427","CRTFREXR","Free Cortisol Excretion Rate","http://id.d4k.dk/dataset/cdisc/ct/v48/sdtm/C65047-C163427"
"5834","Corticosterone","A measurement of corticosterone in a biological specimen.","C79434","CRTRONE","Corticosterone Measurement","http://id.d4k.dk/dataset/cdisc/ct/v48/sdtm/C65047-C79434"
"5835","Cryoglobulin Volume/Serum Volume","A relative measurement (ratio or percentage) of the volume of cryoglobulin to total serum volume in a biological specimen.","C147325","CRYGLBSR","Cryoglobulin Volume to Serum Volume Ratio Measurement","http://id.d4k.dk/dataset/cdisc/ct/v48/sdtm/C65047-C147325"
"5836","Cryofibrinogen","A measurement of the cryofibrinogen in a biological specimen.","C147326","CRYOFBRN","Cryofibrinogen Measurement","http://id.d4k.dk/dataset/cdisc/ct/v48/sdtm/C65047-C147326"
"5837","Cryoglobulin","A measurement of cryoglobulin in a biological specimen.","C111164","CRYOGLBN","Cryoglobulin Measurement","http://id.d4k.dk/dataset/cdisc/ct/v48/sdtm/C65047-C111164"
"5838","Crystals","A statement that indicates crystals were looked for in a biological specimen.","C74673","CRYSTALS","Crystal Present Or Absent","http://id.d4k.dk/dataset/cdisc/ct/v48/sdtm/C65047-C74673"
"5839","Cathepsin Antibody","A measurement of the total cathepsin antibody in a biological specimen.","C120634","CSAB","Cathepsin Antibody Measurement","http://id.d4k.dk/dataset/cdisc/ct/v48/sdtm/C65047-C120634"
"5840","Bacterial Casts","A measurement of the bacterial casts present in a biological specimen.","C74762","CSBACT","Bacterial Cast Measurement","http://id.d4k.dk/dataset/cdisc/ct/v48/sdtm/C65047-C74762"
"5841","Broad Casts","A measurement of the broad casts in a biological specimen.","C96588","CSBROAD","Broad Casts Measurement","http://id.d4k.dk/dataset/cdisc/ct/v48/sdtm/C65047-C96588"
"5842","Cellular Casts","A measurement of the cellular (white blood cell, red blood cell, epithelial and bacterial) casts present in a biological specimen.","C74764","CSCELL","Cellular Cast Measurement","http://id.d4k.dk/dataset/cdisc/ct/v48/sdtm/C65047-C74764"
"5843","Cylindroid Casts;Cylindroid Pseudocasts","A measurement of cylindroid casts (casts with a tapering end) in a biological specimen.","C150838","CSCYL","Cylindroid Cast Measurement","http://id.d4k.dk/dataset/cdisc/ct/v48/sdtm/C65047-C150838"
"5844","Epithelial Casts","A measurement of the epithelial cell casts present in a biological specimen.","C74779","CSEPI","Epithelial-Cast Measurement","http://id.d4k.dk/dataset/cdisc/ct/v48/sdtm/C65047-C74779"
"5845","846-Epitope;Aggrecan Chondroitin Sulfate Epitope 846;Chondroitin Sulfate Epitope 846;Chondroitin Sulfate Proteoglycan 1 Epitope 846;CS846","A measurement of the 846 epitope present on the chondroitin sulfate chains of aggrecan in a biological specimen.","C112220","CSEPI846","Aggrecan Chondroitin Sulfate Epitope 846 Measurement","http://id.d4k.dk/dataset/cdisc/ct/v48/sdtm/C65047-C112220"
"5846","Renal Epithelial Casts","A measurement of the renal epithelial cell casts in a biological specimen.","C174229","CSEPIR","Renal Epithelial Casts Measurement","http://id.d4k.dk/dataset/cdisc/ct/v48/sdtm/C65047-C174229"
"5847","Renal Tubular Epithelial Casts","A measurement of the renal tubular epithelial cell casts in a biological specimen.","C174292","CSEPIRT","Renal Tubular Epithelial Casts Measurement","http://id.d4k.dk/dataset/cdisc/ct/v48/sdtm/C65047-C174292"
"5848","Fatty Casts","A measurement of the fatty casts present in a biological specimen.","C74766","CSFAT","Fatty Cast Measurement","http://id.d4k.dk/dataset/cdisc/ct/v48/sdtm/C65047-C74766"
"5849","CSF IgG Index;CSF Index;IgG Index","A relative measurement (ratio) of the IgG to albumin in cerebrospinal fluid to the IgG to albumin in serum.","C154735","CSFIGIDX","IgG Index","http://id.d4k.dk/dataset/cdisc/ct/v48/sdtm/C65047-C154735"
"5850","Granular Casts","A measurement of the granular (coarse and fine) casts present in a biological specimen.","C74768","CSGRAN","Granular Cast Measurement","http://id.d4k.dk/dataset/cdisc/ct/v48/sdtm/C65047-C74768"
"5851","Granular Coarse Casts","A measurement of the coarse granular casts present in a biological specimen.","C74765","CSGRANC","Coarse Granular Cast Measurement","http://id.d4k.dk/dataset/cdisc/ct/v48/sdtm/C65047-C74765"
"5852","Granular Fine Casts","A measurement of the fine granular casts present in a biological specimen.","C74769","CSGRANF","Granular Fine Cast Measurement","http://id.d4k.dk/dataset/cdisc/ct/v48/sdtm/C65047-C74769"
"5853","Hyaline Casts","A measurement of the hyaline casts present in a biological specimen.","C74770","CSHYAL","Hyaline Cast Measurement","http://id.d4k.dk/dataset/cdisc/ct/v48/sdtm/C65047-C74770"
"5854","Hyalogranular Casts","A measurement of the hyalogranular casts in a biological specimen.","C174305","CSHYGR","Hyalogranular Casts","http://id.d4k.dk/dataset/cdisc/ct/v48/sdtm/C65047-C174305"
"5855","Mixed Casts","A measurement of the mixed (the cast contains a mixture of cell types) casts present in a biological specimen.","C74771","CSMIX","Mixed Cast Count","http://id.d4k.dk/dataset/cdisc/ct/v48/sdtm/C65047-C74771"
"5856","Erythrocyte Casts;RBC Casts","A measurement of the red blood cell casts present in a biological specimen.","C74772","CSRBC","Red Blood Cell Cast Measurement","http://id.d4k.dk/dataset/cdisc/ct/v48/sdtm/C65047-C74772"
"5857","Unclassified Casts","A measurement of the unclassifiable casts present in a biological specimen.","C74776","CSUNCLA","Unclassified Cast Measurement","http://id.d4k.dk/dataset/cdisc/ct/v48/sdtm/C65047-C74776"
"5858","Waxy Casts","A measurement of the waxy casts present in a biological specimen.","C74777","CSWAX","Waxy Cell Cast Measurement","http://id.d4k.dk/dataset/cdisc/ct/v48/sdtm/C65047-C74777"
"5859","WBC Casts","A measurement of the white blood cell casts present in a biological specimen.","C74778","CSWBC","White Blood Cell Cast Measurement","http://id.d4k.dk/dataset/cdisc/ct/v48/sdtm/C65047-C74778"
"5860","Circulating Tumor Cells","A measurement of the circulating tumor cells in a biological specimen.","C96593","CTC","Circulating Tumor Cell Count","http://id.d4k.dk/dataset/cdisc/ct/v48/sdtm/C65047-C96593"
"5861","Citalopram","A measurement of the citalopram present in a biological specimen.","C147327","CTLPRM","Citalopram Measurement","http://id.d4k.dk/dataset/cdisc/ct/v48/sdtm/C65047-C147327"
"5862","Complement Total;Total Hemolytic Complement","A measurement of the total complement in a biological specimen.","C80160","CTOT","Complement Measurement","http://id.d4k.dk/dataset/cdisc/ct/v48/sdtm/C65047-C80160"
"5863","C-Terminal Telopeptide of Type I Collagen;Type I Collagen C-Telopeptides;Type I Collagen X-linked C-telopeptide","A measurement of the type I collagen cross-linked C-telopeptides in a biological specimen.","C82038","CTXI","Type I Collagen C-Telopeptide Measurement","http://id.d4k.dk/dataset/cdisc/ct/v48/sdtm/C65047-C82038"
"5864","Type I Collagen C-Telopeptides/Creat;Type I Collagen X-Linked C-Telopeptides/Creatinine","A relative measurement (ratio or percentage) of the type I collagen cross-linked C-telopeptides to creatinine in a biological specimen.","C127613","CTXICRT","Type I Collagen C-Telopeptide to Creatinine Ratio Measurement","http://id.d4k.dk/dataset/cdisc/ct/v48/sdtm/C65047-C127613"
"5865","Type II Collagen C-Telopeptides;Type II Collagen X-Linked C-Telopeptides","A measurement of the type II collagen cross-linked C-telopeptides in a biological specimen.","C82040","CTXII","Type II Collagen C-Telopeptide Measurement","http://id.d4k.dk/dataset/cdisc/ct/v48/sdtm/C65047-C82040"
"5866","Type II Collagen C-Telopeptides/Creat;Type II Collagen X-Linked C-Telopeptides/Creatinine","A relative measurement (ratio or percentage) of the type II collagen cross-linked C-telopeptides to creatinine in a biological specimen.","C122113","CTXIICRT","Type II Collagen C-Telopeptides to Creatinine Ratio Measurement","http://id.d4k.dk/dataset/cdisc/ct/v48/sdtm/C65047-C122113"
"5867","Chemokine (C-X3-C motif) Ligand 1;Fractalkine;Neurotactin","A measurement of the chemokine (C-X3-C motif) ligand 1 in a biological specimen.","C161361","CX3CL1","Chemokine (C-X3-C Motif) Ligand 1 Measurement","http://id.d4k.dk/dataset/cdisc/ct/v48/sdtm/C65047-C161361"
"5868","Chemokine (C-X-C Motif) Ligand 1;GRO Alpha;GRO/KC;Melanoma Growth Stimulating Activity, Alpha","A measurement of the CXCL1, chemokine (C-X-C motif) ligand 1, in a biological specimen.","C128952","CXCL1","Chemokine (C-X-C Motif) Ligand 1 Measurement","http://id.d4k.dk/dataset/cdisc/ct/v48/sdtm/C65047-C128952"
"5869","Chemokine (C-X-C Motif) Ligand 10;Interferon Gamma-induced Protein 10;IP-10;Small-inducible Cytokine B10","A measurement of the CXCL10, chemokine (C-X-C motif) ligand 10, in a biological specimen.","C112238","CXCL10","Chemokine (C-X-C Motif) Ligand 10 Measurement","http://id.d4k.dk/dataset/cdisc/ct/v48/sdtm/C65047-C112238"
"5870","Chemokine (C-X-C Motif) Ligand 11;I-TAC;IFN-inducible T Cell Alpha Chemoattractant;ITAC","A measurement of the chemokine (C-X-C motif) ligand 11 in a biological specimen.","C161360","CXCL11","Chemokine (C-X-C Motif) Ligand 11 Measurement","http://id.d4k.dk/dataset/cdisc/ct/v48/sdtm/C65047-C161360"
"5871","Chemokine (C-X-C Motif) Ligand 12;IRH;PBSF;SCYB12;SDF1;SDF1A;SDF1B;Stromal Cell-Derived Factor-1 Alpha;Stromal Cell-Derived Factor-1 Beta;TLSF;TPAR1","A measurement of the CXCL12, chemokine (C-X-C motif) ligand 12, in a biological specimen.","C165954","CXCL12","Chemokine (C-X-C Motif) Ligand 12 Measurement","http://id.d4k.dk/dataset/cdisc/ct/v48/sdtm/C65047-C165954"
"5872","B Lymphocyte Chemoattractant;Chemokine (C-X-C Motif) Ligand 13","A measurement of the CXCL13, chemokine (C-X-C motif) ligand 13, in a biological specimen.","C147328","CXCL13","Chemokine (C-X-C Motif) Ligand 13 Measurement","http://id.d4k.dk/dataset/cdisc/ct/v48/sdtm/C65047-C147328"
"5873","Chemokine (C-X-C Motif) Ligand 3;GRO Gamma;Macrophage Inflammatory Protein 2-Beta;MIP2 Beta;MIP2B","A measurement of the CXCL3, chemokine (C-X-C motif) ligand 3, in a biological specimen.","C147329","CXCL3","Chemokine (C-X-C Motif) Ligand 3 Measurement","http://id.d4k.dk/dataset/cdisc/ct/v48/sdtm/C65047-C147329"
"5874","Chemokine (C-X-C Motif) Ligand 4;Oncostatin A;Platelet Factor 4;PLF4","A measurement of the CXCL4, chemokine (C-X-C motif) ligand 4, in a biological specimen.","C147330","CXCL4","Chemokine (C-X-C Motif) Ligand 4 Measurement","http://id.d4k.dk/dataset/cdisc/ct/v48/sdtm/C65047-C147330"
"5875","Chemokine (C-X-C Motif) Ligand 6;GCP2;Granulocyte Chemotactic Protein 2","A measurement of the CXCL6, chemokine (C-X-C motif) ligand 6, in a biological specimen.","C130159","CXCL6","Chemokine (C-X-C Motif) Ligand 6 Measurement","http://id.d4k.dk/dataset/cdisc/ct/v48/sdtm/C65047-C130159"
"5876","B-TG1;Beta-TG;Chemokine (C-X-C Motif) Ligand 7;CTAP-III;CTAP3;CTAPIII;LA-PF4;LDGF;MDGF;NAP-2;Neutrophil-Activating Peptide 2;PBP;PPBP;Pro-Platelet Basic Protein;SCYB7;TC1;TC2;TGB;TGB1;THBGB;THBGB1","A measurement of the pro-platelet basic protein in a biological specimen.","C165955","CXCL7","Chemokine (C-X-C Motif) Ligand 7 Measurement","http://id.d4k.dk/dataset/cdisc/ct/v48/sdtm/C65047-C165955"
"5877","Chemokine (C-X-C Motif) Ligand 9;CMK;crg-10;Humig;MIG;SCYB9","A measurement of the CXCL9, chemokine (C-X-C motif) ligand 9, in a biological specimen.","C165956","CXCL9","Chemokine (C-X-C Motif) Ligand 9 Measurement","http://id.d4k.dk/dataset/cdisc/ct/v48/sdtm/C65047-C165956"
"5878","CD183;Chemokine (C-X-C Motif) Receptor 3;CXCR3;GPR9","A measurement of the CXCR3, chemokine (C-X-C motif) receptor 3, in a biological specimen.","C100431","CXCR3","Chemokine Receptor CXCR3 Measurement","http://id.d4k.dk/dataset/cdisc/ct/v48/sdtm/C65047-C100431"
