"id","alt_label","definition","identifier","notation","pref_label","uri"
"4740","","The portion of the penis between the descending portion of the pubic bone and the body of the penis.","C124350","PENIS, RADIX","Radix Penis","http://id.d4k.dk/dataset/cdisc/ct/v48/sdtm/C74456-C124350"
"4741","","The skin area around the anus. (NCI)","C99148","PERIANAL REGION","Perianal Region","http://id.d4k.dk/dataset/cdisc/ct/v48/sdtm/C74456-C99148"
"4742","","The body space between the epicardium and the pericardium.","C38662","PERICARDIAL CAVITY","Pericardial Cavity","http://id.d4k.dk/dataset/cdisc/ct/v48/sdtm/C74456-C38662"
"4743","","A lymph node located anterior to the pericardium, posterior to the xiphoid process, and in the right and left cardiophrenic fat. (NCI)","C117870","PERICARDIAL LYMPH NODE","Pericardial Lymph Node","http://id.d4k.dk/dataset/cdisc/ct/v48/sdtm/C74456-C117870"
"4744","","The tissue layers that form the pericardium of the heart, including the fibrous pericardium, and the parietal and visceral layers of the serous pericardium.","C127672","PERICARDIAL WALL","Pericardial Wall","http://id.d4k.dk/dataset/cdisc/ct/v48/sdtm/C74456-C127672"
"4745","","The membrane surrounding the heart and roots of the vessels at the base of the heart.","C13005","PERICARDIUM","Pericardium","http://id.d4k.dk/dataset/cdisc/ct/v48/sdtm/C74456-C13005"
"4746","","A lymph node located above the mandibular margin of the submandibular triangle and is associated with the anterior facial vein and facial artery.","C170601","PERIFACIAL LYMPH NODE","Perifacial Lymph Node","http://id.d4k.dk/dataset/cdisc/ct/v48/sdtm/C74456-C170601"
"4747","","A lymph node located in the area around the hilum.","C102330","PERIHILAR LYMPH NODE","Perihilar Lymph Node","http://id.d4k.dk/dataset/cdisc/ct/v48/sdtm/C74456-C102330"
"4748","Perineum","The area located between the anus and vulva in females, and anus and scrotum in males. (NCI)","C33301","PERINEUM","Perineum","http://id.d4k.dk/dataset/cdisc/ct/v48/sdtm/C74456-C33301"
"4749","","Lymph node(s) in or adjacent to the pancreas.","C77642","PERIPANCREATIC LYMPH NODE","Pancreatic Lymph Node","http://id.d4k.dk/dataset/cdisc/ct/v48/sdtm/C74456-C77642"
"4750","","Any nerve outside the brain or spinal cord that connects with peripheral receptors or effectors. (NCI)","C12768","PERIPHERAL NERVE","Peripheral Nerve","http://id.d4k.dk/dataset/cdisc/ct/v48/sdtm/C74456-C12768"
"4751","","Lymph node(s) located in the connective tissue adjacent to the rectum.","C154774","PERIRECTAL LYMPH NODE","Perirectal Lymph Node","http://id.d4k.dk/dataset/cdisc/ct/v48/sdtm/C74456-C154774"
"4752","","A part of the abdominal cavity that lies between the visceral and parietal peritoneum.","C12769","PERITONEAL CAVITY","Peritoneal Cavity","http://id.d4k.dk/dataset/cdisc/ct/v48/sdtm/C74456-C12769"
"4753","","The membrane that lines the abdominal and pelvic cavities.","C12770","PERITONEUM","Peritoneum","http://id.d4k.dk/dataset/cdisc/ct/v48/sdtm/C74456-C12770"
"4754","","The region of the body that immediately surrounds the umbilicus.","C139205","PERIUMBILICAL REGION","Periumbilical Region","http://id.d4k.dk/dataset/cdisc/ct/v48/sdtm/C74456-C139205"
"4755","","The tissue surrounding the ureter.","C132412","PERIURETERAL REGION","Periureteral Region","http://id.d4k.dk/dataset/cdisc/ct/v48/sdtm/C74456-C132412"
"4756","","The tissue surrounding the urethra.","C111287","PERIURETHRAL REGION","Periurethral Region","http://id.d4k.dk/dataset/cdisc/ct/v48/sdtm/C74456-C111287"
"4757","","The region of the body surrounding the urinary bladder. (NCI)","C178003","PERIVESICAL REGION","Perivesical Region","http://id.d4k.dk/dataset/cdisc/ct/v48/sdtm/C74456-C178003"
"4758","","An artery arising from the posterior tibial artery that supplies the muscles on the lateral side of the lower leg.","C33314","PERONEAL ARTERY","Peroneal Artery","http://id.d4k.dk/dataset/cdisc/ct/v48/sdtm/C74456-C33314"
"4759","Adenoid","A tonsil in the mucosa of the nasopharynx.","C33318","PHARYNGEAL TONSIL","Pharyngeal Tonsil","http://id.d4k.dk/dataset/cdisc/ct/v48/sdtm/C74456-C33318"
"4760","","A passageway in the head and neck that includes the nasopharynx, oropharynx and laryngopharynx.","C12425","PHARYNX","Pharynx","http://id.d4k.dk/dataset/cdisc/ct/v48/sdtm/C74456-C12425"
"4761","Pineal Body","A small endocrine gland that arises from the central posterior aspect of the diencephalon.","C12398","PINEAL GLAND","Pineal Gland","http://id.d4k.dk/dataset/cdisc/ct/v48/sdtm/C74456-C12398"
"4762","Pisiform Bone","The medial bone of the proximal row of carpal bones. (NCI)","C12855","PISIFORM BONE","Pisiform Bone","http://id.d4k.dk/dataset/cdisc/ct/v48/sdtm/C74456-C12855"
"4763","Hypophysis;Hypophysis Cerebri","A small endocrine gland extending from the hypothalamus at the base of the brain.","C12399","PITUITARY GLAND","Pituitary Gland","http://id.d4k.dk/dataset/cdisc/ct/v48/sdtm/C74456-C12399"
"4764","","An organ present in true mammals during embryonic developmen that provides the fetus with nutrients and oxygen, facilitates gas and waste exchange between the fetus and mother.","C13272","PLACENTA","Placenta","http://id.d4k.dk/dataset/cdisc/ct/v48/sdtm/C74456-C13272"
"4765","","The serous membrane that lines the wall of the thoracic cavity and the surface of the lungs.","C12469","PLEURA","Pleura","http://id.d4k.dk/dataset/cdisc/ct/v48/sdtm/C74456-C12469"
"4766","","A part of the thoracic cavity that lies between the visceral and parietal pleura.","C12840","PLEURAL CAVITY","Pleural Cavity","http://id.d4k.dk/dataset/cdisc/ct/v48/sdtm/C74456-C12840"
"4767","Pons Varolii","The portion of the brainstem between the midbrain and medulla oblongata.","C12511","PONS VAROLII","Pons Varolii","http://id.d4k.dk/dataset/cdisc/ct/v48/sdtm/C74456-C12511"
"4768","","The segment of the popliteal artery that is located above the knee.","C116180","POPLITEAL ARTERY ABOVE KNEE","Popliteal Artery Above the Knee","http://id.d4k.dk/dataset/cdisc/ct/v48/sdtm/C74456-C116180"
"4769","","The segment of the popliteal artery that is located below the knee.","C116181","POPLITEAL ARTERY BELOW KNEE","Popliteal Artery Below the Knee","http://id.d4k.dk/dataset/cdisc/ct/v48/sdtm/C74456-C116181"
"4770","","A diamond-shaped depression located in the back of the knee joint bounded by the medial and lateral heads of the gastrocnemius muscle, the semimembranosus muscle, and the biceps femoris.","C103222","POPLITEAL FOSSA","Popliteal Fossa","http://id.d4k.dk/dataset/cdisc/ct/v48/sdtm/C74456-C103222"
"4771","","Lymph node(s) adjacent to the femorotibial joint.","C53146","POPLITEAL LYMPH NODE","Popliteal Lymph Node","http://id.d4k.dk/dataset/cdisc/ct/v48/sdtm/C74456-C53146"
"4772","","A vein originating from the anterior and posterior tibial veins that ascends the popliteal space to drain blood from the calf, knee joint, and thigh. The popliteal vein ultimately becomes the femoral vein.","C33339","POPLITEAL VEIN","Popliteal Vein","http://id.d4k.dk/dataset/cdisc/ct/v48/sdtm/C74456-C33339"
"4773","","A lymph node located in the transverse fissure of the liver. (NCI)","C117871","PORTA HEPATIS LYMPH NODE","Porta Hepatis Lymph Node","http://id.d4k.dk/dataset/cdisc/ct/v48/sdtm/C74456-C117871"
"4774","Portocaval Lymph Node","A lymph node located in the space between the portal vein and inferior vena cava, along the hepatoduodenal ligament. (NCI)","C117872","PORTACAVAL LYMPH NODE","Portacaval Lymph Node","http://id.d4k.dk/dataset/cdisc/ct/v48/sdtm/C74456-C117872"
"4775","Periportal Lymph Node","Lymph node(s) adjacent to the portal vein.","C77645","PORTAL LYMPH NODE","Portal Lymph Node","http://id.d4k.dk/dataset/cdisc/ct/v48/sdtm/C74456-C77645"
"4776","","The portion of the distal end of the main portal vein that branches into the left and right portal veins.","C132413","PORTAL VEIN BIFURCATION","Portal Vein Bifurcation","http://id.d4k.dk/dataset/cdisc/ct/v48/sdtm/C74456-C132413"
"4777","Hepatic Portal Vein","A vein lying in the lower part of the abdomen; in general it arises from the junction of the mesenteric and splenic veins and draining into the liver.","C33343","PORTAL VEIN","Portal Vein","http://id.d4k.dk/dataset/cdisc/ct/v48/sdtm/C74456-C33343"
"4778","","A ridge on the parietal lobe of the brain, located between the central and postcentral sulci, that corresponds to the primary somatic sensory cortex area.","C33346","POSTCENTRAL GYRUS","Postcentral Gyrus","http://id.d4k.dk/dataset/cdisc/ct/v48/sdtm/C74456-C33346"
"4779","","A lymph node located in the posterior region of the neck. (NCI)","C103428","POSTERIOR CERVICAL LYMPH NODE","Posterior Cervical Lymph Node","http://id.d4k.dk/dataset/cdisc/ct/v48/sdtm/C74456-C103428"
"4780","","The caudal region of the cingulate cortex, located within the medial part of the inferior parietal lobule, that is thought to function as an interface between emotion and cognition.","C154778","POSTERIOR CINGULATE CORTEX","Posterior Cingulate Cortex","http://id.d4k.dk/dataset/cdisc/ct/v48/sdtm/C74456-C154778"
"4781","PDSP;POSTERIOR DESCENDING SEPTAL PERFORATORS ARTERY SEGMENT","The arteries arising from the right posterior descending artery that supply the interventricular septum.","C102348","POSTERIOR DESCENDING SEPTAL PERFORATORS ARTERY","Septal Perforator Artery","http://id.d4k.dk/dataset/cdisc/ct/v48/sdtm/C74456-C102348"
"4782","PICA","An artery arising from the vertebral artery that supplies the cerebellum, choroid plexus and the lateral medulla.","C33362","POSTERIOR INFERIOR CEREBELLAR ARTERY","Posterior Inferior Cerebellar Artery","http://id.d4k.dk/dataset/cdisc/ct/v48/sdtm/C74456-C33362"
"4783","","The scleral curvature of the eye comprising the retina, inclusive of the macula and optic disc.","C142303","POSTERIOR POLE OF THE EYE","Posterior Pole of the Eye","http://id.d4k.dk/dataset/cdisc/ct/v48/sdtm/C74456-C142303"
"4784","","A bony projection from the posterior region of the iliac crest that lies over the sacroiliac joint and is the site of attachment for the thoracolumbar fascia and the posterior sacroiliac and sacrotuberous ligaments.","C139206","POSTERIOR SUPERIOR ILIAC SPINE","Posterior Superior Iliac Spine","http://id.d4k.dk/dataset/cdisc/ct/v48/sdtm/C74456-C139206"
"4785","","A terminal branch of the popliteal artery that runs along the tibia from the lower portion of the popliteus muscle to the lower ankle with numerous branches supplying the lower leg and foot.","C12826","POSTERIOR TIBIAL ARTERY","Posterior Tibial Artery","http://id.d4k.dk/dataset/cdisc/ct/v48/sdtm/C74456-C12826"
"4786","","A vein in the foot that originates at the union of the external and internal plantar veins and which becomes the popliteal vein.","C33386","POSTERIOR TIBIAL VEIN","Posterior Tibial Vein","http://id.d4k.dk/dataset/cdisc/ct/v48/sdtm/C74456-C33386"
"4787","","In an individual with a right-dominant heart, the arterial branch that arises from the distal right coronary artery in the posterior atrioventricular groove after the origin of the right posterior descending artery.","C116170","POSTEROLATERAL SEGMENTAL ARTERY","Posterolateral Coronary Artery","http://id.d4k.dk/dataset/cdisc/ct/v48/sdtm/C74456-C116170"
"4788","","A lymph node located anterior to the auricle of the ear. (NCI)","C103429","PREAURICULAR LYMPH NODE","Preauricular Lymph Node","http://id.d4k.dk/dataset/cdisc/ct/v48/sdtm/C74456-C103429"
"4789","","A ridge on the convex side of both cerebral hemispheres, anterior to the postcentral gyrus and parallel to the central sulcus, which separates the pre- and postcentral gyri.","C33393","PRECENTRAL GYRUS","Precentral Gyrus","http://id.d4k.dk/dataset/cdisc/ct/v48/sdtm/C74456-C33393"
"4790","","The posteromedial region of the parietal lobe bounded by the marginal branch of the cingulate sulcus anteriorly, by the medial portion of the parieto-occipital fissure posteriorly and by the subparietal sulcus inferiorly.","C112399","PRECUNEUS","Precuneus","http://id.d4k.dk/dataset/cdisc/ct/v48/sdtm/C74456-C112399"
"4791","","The gray matter on the medial, lateral, and orbital surfaces of the anterior part of the frontal cortex, which play a role in complex cognitive control, emotion, and social behavior.","C154779","PREFRONTAL CORTEX","Prefrontal Cortex","http://id.d4k.dk/dataset/cdisc/ct/v48/sdtm/C74456-C154779"
"4792","","A lymph node located anterior to the larynx.","C147454","PRELARYNGEAL LYMPH NODE","Prelaryngeal Lymph Node","http://id.d4k.dk/dataset/cdisc/ct/v48/sdtm/C74456-C147454"
"4793","","Exocrine glands of the male reproductive system located adjacent to the prepuce.","C79432","PREPUTIAL GLAND","Preputial Gland","http://id.d4k.dk/dataset/cdisc/ct/v48/sdtm/C74456-C79432"
"4794","","Lymph node(s) located in the mesorectum, between the rectum and the sacrum.","C154775","PRESACRAL LYMPH NODE","Presacral Lymph Node","http://id.d4k.dk/dataset/cdisc/ct/v48/sdtm/C74456-C154775"
"4795","","The potential body space formed between the rectum and the sacrum.","C132414","PRESACRAL SPACE","Presacral Space","http://id.d4k.dk/dataset/cdisc/ct/v48/sdtm/C74456-C132414"
"4796","","A lymph node located anterior to the trachea, between the isthmus of the thyroid gland and the innominate vein.","C147455","PRETRACHEAL LYMPH NODE","Pretracheal Lymph Node","http://id.d4k.dk/dataset/cdisc/ct/v48/sdtm/C74456-C147455"
"4797","","A brain region in the occipital cortex that receives visual stimuli from the retina. (NCI)","C97340","PRIMARY VISUAL CORTEX","Primary Visual Cortex","http://id.d4k.dk/dataset/cdisc/ct/v48/sdtm/C74456-C97340"
"4798","","A muscle in the face, in general extending from the lower part of the nasal bone to the frontalis muscle in the forehead; primary function is to move the skin between the eyebrows.","C166001","PROCERUS MUSCLE","Procerus Muscle","http://id.d4k.dk/dataset/cdisc/ct/v48/sdtm/C74456-C166001"
"4799","","An artery arising from the common femoral artery just below the inguinal ligament running close to the femur and ending in the lower third of the thigh with branches supplying the thigh muscles.","C32436","PROFUNDA FEMORIS ARTERY","Deep Femoral Artery","http://id.d4k.dk/dataset/cdisc/ct/v48/sdtm/C74456-C32436"
"4800","Deep Femoral Vein","A vein located in the upper thigh that connects, through tributaries, to the popliteal and inferior gluteal veins, and joins the superficial femoral vein at the groin to form the common femoral vein.","C154776","PROFUNDA FEMORIS VEIN","Deep Femoral Vein","http://id.d4k.dk/dataset/cdisc/ct/v48/sdtm/C74456-C154776"
"4801","","A muscle of the forearm, in general extending from the distal anteromedial surface of the ulna to the distal anterolateral surface of the radius; primary function is pronation of the forearm.","C150854","PRONATOR QUADRATUS MUSCLE","Pronator Quadratus Muscle","http://id.d4k.dk/dataset/cdisc/ct/v48/sdtm/C74456-C150854"
"4802","","A muscle of the superficial flexor compartment of the forearm, in general extending from the humeral and ulnar heads to the body of the radius; primary function is pronation of the arm and flexion of the elbow.","C53174","PRONATOR TERES MUSCLE","Pronator Teres Muscle","http://id.d4k.dk/dataset/cdisc/ct/v48/sdtm/C74456-C53174"
"4803","","The male reproductive accessory gland that produces prostatic fluid and is located adjacent to or around the urethra distal to the urinary bladder in mammals.","C12410","PROSTATE GLAND","Prostate Gland","http://id.d4k.dk/dataset/cdisc/ct/v48/sdtm/C74456-C12410"
"4804","Lateral Lobe of the Prostate","The prostate gland lobe that is located on the lateral side of the organ. (NCI)","C13092","PROSTATE GLAND, LATERAL LOBE","Lateral Lobe of the Prostate","http://id.d4k.dk/dataset/cdisc/ct/v48/sdtm/C74456-C13092"
"4805","Middle Lobe of the Prostate","The upper, smaller part of the prostate between the ejaculatory ducts and the urethra. (NCI)","C13094","PROSTATE GLAND, MIDDLE LOBE","Middle Lobe of the Prostate","http://id.d4k.dk/dataset/cdisc/ct/v48/sdtm/C74456-C13094"
"4806","Posterior Lobe of the Prostate","The prostate gland lobe that is located on the posterior side of the organ. (NCI)","C13093","PROSTATE GLAND, POSTERIOR LOBE","Posterior Lobe of the Prostate","http://id.d4k.dk/dataset/cdisc/ct/v48/sdtm/C74456-C13093"
"4807","PCIRC;PROXIMAL CIRCUMFLEX ARTERY SEGMENT","The section of the left circumflex coronary artery that arises from the left main coronary artery and extends to the first marginal branch.","C102331","PROXIMAL CIRCUMFLEX ARTERY","Proximal Circumflex Artery","http://id.d4k.dk/dataset/cdisc/ct/v48/sdtm/C74456-C102331"
"4808","PIP2 of the Foot","A ginglymoid (hinge) synovial joint within the second digit of the foot articulating the proximal and middle phalanges. (NCI)","C114205","PROXIMAL INTERPHALANGEAL JOINT 2 OF THE FOOT","Proximal Interphalangeal Joint 2 of the Foot","http://id.d4k.dk/dataset/cdisc/ct/v48/sdtm/C74456-C114205"
"4809","PIP2 of the Hand","A ginglymoid (hinge) synovial joint within the second digit of the hand articulating the proximal and middle phalanges. (NCI)","C114194","PROXIMAL INTERPHALANGEAL JOINT 2 OF THE HAND","Proximal Interphalangeal Joint 2 of the Hand","http://id.d4k.dk/dataset/cdisc/ct/v48/sdtm/C74456-C114194"
"4810","PIP2","A condyloid synovial joint within the second digit of the hand or foot articulating the proximal and middle phalanges. (NCI)","C102332","PROXIMAL INTERPHALANGEAL JOINT 2","Proximal Interphalangeal Joint 2","http://id.d4k.dk/dataset/cdisc/ct/v48/sdtm/C74456-C102332"
"4811","PIP3 of the Foot","A ginglymoid (hinge) synovial joint within the third digit of the foot articulating the proximal and middle phalanges. (NCI)","C114206","PROXIMAL INTERPHALANGEAL JOINT 3 OF THE FOOT","Proximal Interphalangeal Joint 3 of the Foot","http://id.d4k.dk/dataset/cdisc/ct/v48/sdtm/C74456-C114206"
"4812","PIP3 of the Hand","A ginglymoid (hinge) synovial joint within the third digit of the hand articulating the proximal and middle phalanges. (NCI)","C114195","PROXIMAL INTERPHALANGEAL JOINT 3 OF THE HAND","Proximal Interphalangeal Joint 3 of the Hand","http://id.d4k.dk/dataset/cdisc/ct/v48/sdtm/C74456-C114195"
"4813","PIP3","A condyloid synovial joint within the third digit of the hand or foot articulating the proximal and middle phalanges. (NCI)","C102333","PROXIMAL INTERPHALANGEAL JOINT 3","Proximal Interphalangeal Joint 3","http://id.d4k.dk/dataset/cdisc/ct/v48/sdtm/C74456-C102333"
"4814","PIP4 of the Foot","A condyloid synovial joint within the fourth digit of the hand or foot articulating the proximal and middle phalanges. (NCI)","C114207","PROXIMAL INTERPHALANGEAL JOINT 4 OF THE FOOT","Proximal Interphalangeal Joint 4 of the Foot","http://id.d4k.dk/dataset/cdisc/ct/v48/sdtm/C74456-C114207"
"4815","PIP4 of the Hand","A ginglymoid (hinge) synovial joint within the fourth digit of the hand articulating the proximal and middle phalanges. (NCI)","C114196","PROXIMAL INTERPHALANGEAL JOINT 4 OF THE HAND","Proximal Interphalangeal Joint 4 of the Hand","http://id.d4k.dk/dataset/cdisc/ct/v48/sdtm/C74456-C114196"
"4816","PIP4","A condyloid synovial joint within the fourth digit of the hand or foot articulating the proximal and middle phalanges. (NCI)","C102334","PROXIMAL INTERPHALANGEAL JOINT 4","Proximal Interphalangeal Joint 4","http://id.d4k.dk/dataset/cdisc/ct/v48/sdtm/C74456-C102334"
"4817","PIP5 of the Foot","A ginglymoid (hinge) synovial joint within the fifth digit of the foot articulating the proximal and middle phalanges. (NCI)","C114208","PROXIMAL INTERPHALANGEAL JOINT 5 OF THE FOOT","Proximal Interphalangeal Joint 5 of the Foot","http://id.d4k.dk/dataset/cdisc/ct/v48/sdtm/C74456-C114208"
"4818","PIP5 of the Hand","A ginglymoid (hinge) synovial joint within the fifth digit of the hand articulating the proximal and middle phalanges. (NCI)","C114197","PROXIMAL INTERPHALANGEAL JOINT 5 OF THE HAND","Proximal Interphalangeal Joint 5 of the Hand","http://id.d4k.dk/dataset/cdisc/ct/v48/sdtm/C74456-C114197"
"4819","PIP5","A condyloid synovial joint within the fifth digit of the hand or foot articulating the proximal and middle phalanges. (NCI)","C102335","PROXIMAL INTERPHALANGEAL JOINT 5","Proximal Interphalangeal Joint 5","http://id.d4k.dk/dataset/cdisc/ct/v48/sdtm/C74456-C102335"
"4820","PLAD;PROXIMAL LAD ARTERY SEGMENT","The section of the left anterior descending coronary artery that arises from the left main coronary artery and extends to the first diagonal branch.","C102336","PROXIMAL LAD ARTERY","Proximal Left Anterior Descending Artery","http://id.d4k.dk/dataset/cdisc/ct/v48/sdtm/C74456-C102336"
"4821","","The long bone in the first finger, as counted from the thenar side of the hand; it is located between, and articulates with, the first metacarpal and the distal phalanx.","C150848","PROXIMAL PHALANX 1 OF THE HAND","Hand Digit 1 Proximal Phalanx","http://id.d4k.dk/dataset/cdisc/ct/v48/sdtm/C74456-C150848"
"4822","","The long bone in the second finger, as counted from the thenar side of the hand; it is located between, and articulates with, the second metacarpal and the middle phalanx.","C142304","PROXIMAL PHALANX 2 OF THE HAND","Hand Digit 2 Proximal Phalanx","http://id.d4k.dk/dataset/cdisc/ct/v48/sdtm/C74456-C142304"
"4823","","The long bone in the third finger, as counted from the thenar side of the hand; it is located between, and articulates with, the third metacarpal and the middle phalanx.","C142305","PROXIMAL PHALANX 3 OF THE HAND","Hand Digit 3 Proximal Phalanx","http://id.d4k.dk/dataset/cdisc/ct/v48/sdtm/C74456-C142305"
"4824","","The long bone in the fourth finger, as counted from the thenar side of the hand; it is located between, and articulates with, the fourth metacarpal and the middle phalanx.","C142306","PROXIMAL PHALANX 4 OF THE HAND","Hand Digit 4 Proximal Phalanx","http://id.d4k.dk/dataset/cdisc/ct/v48/sdtm/C74456-C142306"
"4825","","The long bone in the fifth finger, as counted from the thenar side of the hand; it is located between, and articulates with, the fifth metacarpal and the middle phalanx.","C142307","PROXIMAL PHALANX 5 OF THE HAND","Hand Digit 5 Proximal Phalanx","http://id.d4k.dk/dataset/cdisc/ct/v48/sdtm/C74456-C142307"
"4826","PRCA;PROXIMAL RIGHT CORONARY ARTERY CONDUIT SEGMENT","The section of the right coronary artery proximal to the origin of the right ventricular artery.","C102337","PROXIMAL RIGHT CORONARY ARTERY CONDUIT","Proximal Right Coronary Artery Conduit","http://id.d4k.dk/dataset/cdisc/ct/v48/sdtm/C74456-C102337"
"4827","","The part of the urethra that is close to the bladder.","C115335","PROXIMAL URETHRA","Proximal Urethra","http://id.d4k.dk/dataset/cdisc/ct/v48/sdtm/C74456-C115335"
"4828","Pubis","Either of the two bones (left and right) that form the front of the pelvis. (NCI)","C33423","PUBIC BONE","Pubic Bone","http://id.d4k.dk/dataset/cdisc/ct/v48/sdtm/C74456-C33423"
"4829","","One of the arteries of the thorax; in general it arises from the pulmonary trunk and branches into the lungs.","C12774","PULMONARY ARTERY BRANCH","Pulmonary Artery","http://id.d4k.dk/dataset/cdisc/ct/v48/sdtm/C74456-C12774"
"4830","Main Pulmonary Artery","The artery arising from the right ventricle of the heart that bifurcates into the left and right pulmonary arteries.","C116918","PULMONARY TRUNK","Pulmonary Trunk","http://id.d4k.dk/dataset/cdisc/ct/v48/sdtm/C74456-C116918"
"4831","","A cardiac valve located between the right atrium and the pulmonary artery.","C12775","PULMONARY VALVE","Pulmonary Valve","http://id.d4k.dk/dataset/cdisc/ct/v48/sdtm/C74456-C12775"
"4832","Pulmonary Valve, Anterior Semilunar Cusp","The cusp of the pulmonic valve that has no attachment to the cardiac septum.","C127673","PULMONARY VALVE, ANTERIOR CUSP","Anterior Cusp of the Pulmonary Valve","http://id.d4k.dk/dataset/cdisc/ct/v48/sdtm/C74456-C127673"
"4833","Pulmonary Valve, Left Semilunar Cusp","The cusp of the pulmonic valve attached to the left side of the cardiac septum.","C127674","PULMONARY VALVE, LEFT CUSP","Left Cusp of the Pulmonary Valve","http://id.d4k.dk/dataset/cdisc/ct/v48/sdtm/C74456-C127674"
"4834","Pulmonary Valve, Right Semilunar Cusp","The cusp of the pulmonic valve attached to the right side of the cardiac septum.","C127675","PULMONARY VALVE, RIGHT CUSP","Right Cusp of the Pulmonary Valve","http://id.d4k.dk/dataset/cdisc/ct/v48/sdtm/C74456-C127675"
"4835","","The round opening in the center of the iris in the eye.","C33429","PUPIL","Pupil","http://id.d4k.dk/dataset/cdisc/ct/v48/sdtm/C74456-C33429"
"4836","Putamen","The gray matter, located between the globus pallidus and the external capsule of the brain, that comprises the lateral dorsal striatum of the basal ganglia.","C12452","PUTAMEN","Putamen","http://id.d4k.dk/dataset/cdisc/ct/v48/sdtm/C74456-C12452"
"4837","Pyloric Sphincter","The muscular structure at the distal portion of the stomach, opening into the duodenum. (NCI)","C33433","PYLORIC SPHINCTER","Pyloric Sphincter","http://id.d4k.dk/dataset/cdisc/ct/v48/sdtm/C74456-C33433"
"4838","","The region of the stomach that connects to the duodenum.","C12260","PYLORUS","Pylorus","http://id.d4k.dk/dataset/cdisc/ct/v48/sdtm/C74456-C12260"
"4839","","The segments of the corticospinal and corticobulbar tracts that either traverse or terminate in the brainstem. (NCI)","C142308","PYRAMIDAL TRACTS, BRAINSTEM","Brainstem Portion of the Pyramidal Tracts","http://id.d4k.dk/dataset/cdisc/ct/v48/sdtm/C74456-C142308"
"4840","","The segments of the corticospinal and corticobulbar tracts that traverse the internal capsule.","C142309","PYRAMIDAL TRACTS, INTERNAL CAPSULE","Internal Capsule of the Pyramidal Tracts","http://id.d4k.dk/dataset/cdisc/ct/v48/sdtm/C74456-C142309"
"4841","","A group of muscles in the thigh, in general extending from the pelvis to the patella and tibia; primary function is extension of the femorotibial joint.","C33441","QUADRICEPS MUSCLE","Quadriceps Muscle of the Thigh","http://id.d4k.dk/dataset/cdisc/ct/v48/sdtm/C74456-C33441"
