"id","alt_label","definition","identifier","notation","pref_label","uri"
"5178","Alpha-1 Acid Glycoprotein","A measurement of the alpha-1 acid glycoprotein in a biological specimen.","C100429","A1AGLP","Alpha-1 Acid Glycoprotein Measurement","http://id.d4k.dk/dataset/cdisc/ct/v48/sdtm/C65047-C100429"
"5179","Alpha-1 Antitrypsin, Functional","A measurement of the functional alpha-1 antitrypsin in a biological specimen.","C181404","A1ANTRPF","Functional Alpha-1 Antitrypsin Measurement","http://id.d4k.dk/dataset/cdisc/ct/v48/sdtm/C65047-C181404"
"5180","Alpha-1 Antitrypsin;Serum Trypsin Inhibitor","A measurement of the alpha-1 antitrypsin in a biological specimen.","C80167","A1ANTRYP","Alpha-1 Antitrypsin Measurement","http://id.d4k.dk/dataset/cdisc/ct/v48/sdtm/C65047-C80167"
"5181","Alpha-1 Microglobulin/Creatinine","A relative measurement (ratio or percentage) of the alpha-1 microglobulin to creatinine in a biological specimen.","C100462","A1MCREAT","Alpha-1 Microglobulin to Creatinine Ratio Measurement","http://id.d4k.dk/dataset/cdisc/ct/v48/sdtm/C65047-C100462"
"5182","Alpha-1 Microglobulin;Protein HC","A measurement of the alpha-1 microglobulin in a biological specimen.","C100461","A1MICG","Alpha-1 Microglobulin Measurement","http://id.d4k.dk/dataset/cdisc/ct/v48/sdtm/C65047-C100461"
"5183","Alpha-2 Macroglobulin","A measurement of the alpha-2 macroglobulin in a biological specimen.","C80168","A2MACG","Alpha-2 Macroglobulin Measurement","http://id.d4k.dk/dataset/cdisc/ct/v48/sdtm/C65047-C80168"
"5184","7-Alpha hydroxy-4-cholesten-3-one;7-alpha-Hydroxy-4-cholesten-3-one","A measurement of the 7-alpha-hydroxy-4-cholesten-3-one in a biological specimen.","C172524","A73OXC","7-alpha-Hydroxy-4-cholesten-3-one Measurement","http://id.d4k.dk/dataset/cdisc/ct/v48/sdtm/C65047-C172524"
"5185","Alpha-Aminoadipate;Alpha-Aminoadipic Acid","A measurement of the alpha-aminoadipic acid in a biological specimen.","C154761","AAMAPAC","Alpha-Aminoadipic Acid Measurement","http://id.d4k.dk/dataset/cdisc/ct/v48/sdtm/C65047-C154761"
"5186","Alpha-aminobutyrate;Alpha-Aminobutyric Acid;Homoalanine","A measurement of the alpha-aminobutyric acid in a biological specimen.","C154759","AAMBTAC","Alpha-Aminobutyric Acid Measurement","http://id.d4k.dk/dataset/cdisc/ct/v48/sdtm/C65047-C154759"
"5187","Alanine Aminopeptidase","A measurement of the alanine aminopeptidase in a biological specimen.","C100430","AAP","Alanine Aminopeptidase Measurement","http://id.d4k.dk/dataset/cdisc/ct/v48/sdtm/C65047-C100430"
"5188","AB-FUBINACA","A measurement of the synthetic cannabinoid AB-FUBINACA in a biological specimen.","C184526","ABFBCA","AB-FUBINACA Measurement","http://id.d4k.dk/dataset/cdisc/ct/v48/sdtm/C65047-C184526"
"5189","Abnormal Cells","A measurement of the abnormal cells in a biological specimen.","C111124","ABNCE","Abnormal Cell Count","http://id.d4k.dk/dataset/cdisc/ct/v48/sdtm/C65047-C111124"
"5190","Abnormal Cells/Total Cells","A relative measurement (ratio or percentage) of abnormal cells to total cells in a biological specimen.","C150835","ABNCECE","Abnormal Cells to Total Cells Ratio Measurement","http://id.d4k.dk/dataset/cdisc/ct/v48/sdtm/C65047-C150835"
"5191","Abnormal Cells/Leukocytes","A relative measurement (ratio or percentage) of abnormal cells to leukocytes in a biological specimen.","C150834","ABNCELE","Abnormal Cells to Leukocytes Ratio Measurement","http://id.d4k.dk/dataset/cdisc/ct/v48/sdtm/C65047-C150834"
"5192","ABO Blood Group","The characterization of the blood type of an individual by testing for the presence of A antigen and B antigen on the surface of red blood cells.","C125939","ABO","ABO Blood Group Determination","http://id.d4k.dk/dataset/cdisc/ct/v48/sdtm/C65047-C125939"
"5193","ABO A1 Subtype","The characterization of the ABO blood group A1 subtype in an individual. (NCI)","C135397","ABOA1","ABO A1 Subtype Determination","http://id.d4k.dk/dataset/cdisc/ct/v48/sdtm/C65047-C135397"
"5194","AB-PINACA","A measurement of the synthetic cannabinoid AB-PINACA in a biological specimen.","C184527","ABPNCA","AB-PINACA Measurement","http://id.d4k.dk/dataset/cdisc/ct/v48/sdtm/C65047-C184527"
"5195","Acanthocytes","A measurement of the acanthocytes in a biological specimen.","C74699","ACANT","Acanthocyte Count","http://id.d4k.dk/dataset/cdisc/ct/v48/sdtm/C65047-C74699"
"5196","Acanthocytes/Erythrocytes","A relative measurement (ratio or percentage) of acanthocytes to all erythrocytes in a biological specimen.","C74633","ACANTRBC","Acanthocyte to Erythrocyte Ratio Measurement","http://id.d4k.dk/dataset/cdisc/ct/v48/sdtm/C65047-C74633"
"5197","Angiotensin Converting Enzyme","A measurement of the angiotensin converting enzyme in a biological specimen.","C80169","ACE","Angiotensin Converting Enzyme Measurement","http://id.d4k.dk/dataset/cdisc/ct/v48/sdtm/C65047-C80169"
"5198","Acetaminophen;Paracetamol","A measurement of the acetaminophen in a biological specimen.","C135398","ACETAMIN","Acetaminophen Measurement","http://id.d4k.dk/dataset/cdisc/ct/v48/sdtm/C65047-C135398"
"5199","Acetoacetate;Acetoacetic Acid","A measurement of the acetoacetic acid in a biological specimen.","C92247","ACETOAC","Acetoacetic Acid Measurement","http://id.d4k.dk/dataset/cdisc/ct/v48/sdtm/C65047-C92247"
"5200","Acetone","A measurement of the acetone in a biological specimen.","C147288","ACETONE","Acetone Measurement","http://id.d4k.dk/dataset/cdisc/ct/v48/sdtm/C65047-C147288"
"5201","Acetylcholine","A measurement of the acetylcholine hormone in a biological specimen.","C74838","ACH","Acetylcholine Measurement","http://id.d4k.dk/dataset/cdisc/ct/v48/sdtm/C65047-C74838"
"5202","Acetylcholinesterase","A measurement of the acetylcholinesterase in a biological specimen.","C96560","ACHE","Acetylcholinesterase Measurement","http://id.d4k.dk/dataset/cdisc/ct/v48/sdtm/C65047-C96560"
"5203","Acetylcholine Receptor Antibody","A measurement of the acetylcholine receptor antibody in a biological specimen.","C96559","ACHRAB","Acetylcholine Receptor Antibody Measurement","http://id.d4k.dk/dataset/cdisc/ct/v48/sdtm/C65047-C96559"
"5204","Acid Phosphatase","A measurement of the acid phosphatase in a biological specimen.","C80163","ACPHOS","Acid Phosphatase Measurement","http://id.d4k.dk/dataset/cdisc/ct/v48/sdtm/C65047-C80163"
"5205","Acylcarnitine/Carnitine, Free","A relative measurement (ratio or percentage) of the acylcarnitine to free carnitine in a biological specimen.","C147289","ACRNCRNF","Acylcarnitine to Free Carnitine Ratio Measurement","http://id.d4k.dk/dataset/cdisc/ct/v48/sdtm/C65047-C147289"
"5206","Activated Clotting Time;Activated Coagulation Time","A measurement of the inhibition of blood coagulation in response to anticoagulant therapies.","C103348","ACT","Activated Coagulation Time","http://id.d4k.dk/dataset/cdisc/ct/v48/sdtm/C65047-C103348"
"5207","Actin Beta;B-Actin;Beta-Actin","A measurement of the beta-actin in a biological specimen.","C184510","ACTB","Beta-Actin Measurement","http://id.d4k.dk/dataset/cdisc/ct/v48/sdtm/C65047-C184510"
"5208","Adrenocorticotropic Hormone;Corticotropin","A measurement of the adrenocorticotropic hormone in a biological specimen.","C74780","ACTH","Adrenocorticotropic Hormone Measurement","http://id.d4k.dk/dataset/cdisc/ct/v48/sdtm/C65047-C74780"
"5209","Acylcarnitine","A measurement of the acylcarnitine in a biological specimen.","C156535","ACYCRNTN","Acylcarnitine Measurement","http://id.d4k.dk/dataset/cdisc/ct/v48/sdtm/C65047-C156535"
"5210","Acylglycine","A measurement of the acylglycine in a biological specimen.","C156534","ACYGLYCN","Acylglycine Measurement","http://id.d4k.dk/dataset/cdisc/ct/v48/sdtm/C65047-C156534"
"5211","Acyl CoA Oxidase;Acyl Coenzyme A Oxidase;Fatty Acyl Coenzyme A Oxidase","A measurement of the acyl coenzyme A oxidase in a biological specimen.","C92286","ACYLCAOX","Acyl Coenzyme A Oxidase Measurement","http://id.d4k.dk/dataset/cdisc/ct/v48/sdtm/C65047-C92286"
"5212","A Disintegrin And Metalloproteinase Domain 8;ADAM Metallopeptidase Domain 8;CD156a Antigen","A measurement of the ADAM metallopeptidase domain 8 protein in a biological specimen.","C147290","ADAM8","ADAM Metallopeptidase Domain 8 Measurement","http://id.d4k.dk/dataset/cdisc/ct/v48/sdtm/C65047-C147290"
"5213","ADB-PINACA","A measurement of the synthetic cannabinoid ADB-PINACA in a biological specimen.","C184529","ADBPNCA","ADB-PINACA Measurement","http://id.d4k.dk/dataset/cdisc/ct/v48/sdtm/C65047-C184529"
"5214","Antidiuretic Hormone;Vasopressin","A measurement of the antidiuretic hormone in a biological specimen.","C74847","ADH","Antidiuretic Hormone Measurement","http://id.d4k.dk/dataset/cdisc/ct/v48/sdtm/C65047-C74847"
"5215","Asymmetric Dimethylarginine;N,N-dimethylarginine","A measurement of asymmetric dimethylarginine in a biological specimen.","C158233","ADMA","Asymmetric Dimethylarginine Measurement","http://id.d4k.dk/dataset/cdisc/ct/v48/sdtm/C65047-C158233"
"5216","Adenosine Diphosphate","A measurement of the adenosine diphosphate in a biological specimen.","C102257","ADP","Adenosine Diphosphate Measurement","http://id.d4k.dk/dataset/cdisc/ct/v48/sdtm/C65047-C102257"
"5217","Adiponectin","A measurement of the total adiponectin hormone in a biological specimen.","C74839","ADPNCTN","Adiponectin Measurement","http://id.d4k.dk/dataset/cdisc/ct/v48/sdtm/C65047-C74839"
"5218","Adiponectin, High Molecular Weight","A measurement of the high molecular weight adiponectin hormone in a biological specimen.","C132363","ADPNHMW","High Molecular Weight Adiponectin Measurement","http://id.d4k.dk/dataset/cdisc/ct/v48/sdtm/C65047-C132363"
"5219","Anti-Double Stranded DNA","A measurement of the anti-double stranded DNA antibody in a biological specimen.","C74913","ADSDNA","Anti-Double Stranded DNA Measurement","http://id.d4k.dk/dataset/cdisc/ct/v48/sdtm/C65047-C74913"
"5220","Anti-Factor Xa Activity","A measurement of the ability of antithrombin to inactivate activated Factor X in a biological specimen. This test is used to monitor low molecular weight or unfractionated heparin levels in a biological specimen.","C98706","AFACTXAA","Anti-Factor Xa Activity Measurement","http://id.d4k.dk/dataset/cdisc/ct/v48/sdtm/C65047-C98706"
"5221","Alpha Fetoprotein;Alpha-1-Fetoprotein","A measurement of the alpha fetoprotein in a biological specimen.","C74732","AFP","Alpha-fetoprotein Measurement","http://id.d4k.dk/dataset/cdisc/ct/v48/sdtm/C65047-C74732"
"5222","Alpha Fetoprotein Adj for Body Weight","A measurement of alpha fetoprotein, which has been adjusted for body weight, in a biological specimen.","C147291","AFPADJBW","Alpha Fetoprotein Adjusted for Body Weight Measurement","http://id.d4k.dk/dataset/cdisc/ct/v48/sdtm/C65047-C147291"
"5223","Alpha Fetoprotein L1","A measurement of the alpha fetoprotein L1 in a biological specimen.","C96562","AFPL1","Alpha Fetoprotein L1 Measurement","http://id.d4k.dk/dataset/cdisc/ct/v48/sdtm/C65047-C96562"
"5224","Alpha Fetoprotein L2","A measurement of the alpha fetoprotein L2 in a biological specimen.","C96563","AFPL2","Alpha Fetoprotein L2 Measurement","http://id.d4k.dk/dataset/cdisc/ct/v48/sdtm/C65047-C96563"
"5225","Alpha Fetoprotein L3","A measurement of the alpha fetoprotein L3 in a biological specimen.","C96564","AFPL3","Alpha Fetoprotein L3 Measurement","http://id.d4k.dk/dataset/cdisc/ct/v48/sdtm/C65047-C96564"
"5226","A Fetoprotein L3/A Fetoprotein","A relative measurement (ratio or percentage) of alpha fetoprotein L3 to total alpha fetoprotein in a biological specimen.","C96565","AFPL3AFP","Alpha Fetoprotein L3 to Total Alpha Fetoprotein Ratio Measurement","http://id.d4k.dk/dataset/cdisc/ct/v48/sdtm/C65047-C96565"
"5227","1,5-Anhydroglucitol","A measurement of the 1,5-anhydroglucitol in a biological specimen.","C124334","AG1_5","1,5-Anhydroglucitol Measurement","http://id.d4k.dk/dataset/cdisc/ct/v48/sdtm/C65047-C124334"
"5228","Alpha Hydroxybutyrate Dehydrogenase","A measurement of the alpha-hydroxybutyrate dehydrogenase in a biological specimen.","C111126","AHBDH","Alpha Hydroxybutyrate Dehydrogenase Measurement","http://id.d4k.dk/dataset/cdisc/ct/v48/sdtm/C65047-C111126"
"5229","Alpha-Hydroxytriazolam","A measurement of the alpha-hydroxytriazolam a biological specimen.","C181418","AHTRZLM","Alpha-Hydroxytriazolam Measurement","http://id.d4k.dk/dataset/cdisc/ct/v48/sdtm/C65047-C181418"
"5230","Alanine","A measurement of the alanine in a biological specimen.","C122091","ALA","Alanine Measurement","http://id.d4k.dk/dataset/cdisc/ct/v48/sdtm/C65047-C122091"
"5231","Apolipoprotein A1/Apolipoprotein B","A relative measurement (ratio or percentage) of the Apolipoprotein A1 to Apolipoprotein B in a biological specimen.","C147292","ALA1ALB","Apolipoprotein A1 to Apolipoprotein B Ratio Measurement","http://id.d4k.dk/dataset/cdisc/ct/v48/sdtm/C65047-C147292"
"5232","Apolipoprotein A/Apolipoprotein B","A relative measurement (ratio) of the total apolipoprotein A to apolipoprotein B in a biological specimen.","C158222","ALAALB","Apolipoprotein A to Apolipoprotein B Ratio Measurement","http://id.d4k.dk/dataset/cdisc/ct/v48/sdtm/C65047-C158222"
"5233","Albumin;Microalbumin","A measurement of the albumin protein in a biological specimen.","C64431","ALB","Albumin Measurement","http://id.d4k.dk/dataset/cdisc/ct/v48/sdtm/C65047-C64431"
"5234","Albumin Clearance","A measurement of the albumin clearance in a biological specimen.","C147293","ALBC","Albumin Clearance","http://id.d4k.dk/dataset/cdisc/ct/v48/sdtm/C65047-C147293"
"5235","Albumin/Creatinine;Microalbumin/Creatinine Ratio","A relative measurement (ratio) of the albumin to the creatinine in a biological specimen.","C74761","ALBCREAT","Albumin To Creatinine Protein Ratio Measurement","http://id.d4k.dk/dataset/cdisc/ct/v48/sdtm/C65047-C74761"
"5236","Albumin Excretion Rate","A measurement of the amount of albumin excreted in a biological specimen over a defined period of time (e.g. one hour).","C150814","ALBEXR","Albumin Excretion Rate","http://id.d4k.dk/dataset/cdisc/ct/v48/sdtm/C65047-C150814"
"5237","Glycated Albumin/Albumin;Glycosylated Albumin/Albumin","A relative measurement (ratio or percentage) of the glycated albumin to total albumin in a biological specimen.","C158228","ALBGALB","Glycated Albumin to Albumin Ratio Measurement","http://id.d4k.dk/dataset/cdisc/ct/v48/sdtm/C65047-C158228"
"5238","Albumin/Globulin","The ratio of albumin to globulin in a biological specimen.","C74894","ALBGLOB","Albumin to Globulin Ratio Measurement","http://id.d4k.dk/dataset/cdisc/ct/v48/sdtm/C65047-C74894"
"5239","Glycated Albumin","A measurement of the glycated albumin present in a biological specimen.","C122092","ALBGLYCA","Glycated Albumin Measurement","http://id.d4k.dk/dataset/cdisc/ct/v48/sdtm/C65047-C122092"
"5240","Albumin Index","A relative measurement (ratio) of the albumin in cerebrospinal fluid to albumin in serum or plasma in a biological specimen.","C154734","ALBIDX","Albumin Index","http://id.d4k.dk/dataset/cdisc/ct/v48/sdtm/C65047-C154734"
"5241","Albumin/Total Protein","A relative measurement (ratio or percentage) of the albumin to total protein in a biological specimen.","C103453","ALBPROT","Albumin to Total Protein Ratio Measurement","http://id.d4k.dk/dataset/cdisc/ct/v48/sdtm/C65047-C103453"
"5242","Aldrin Epoxidase","A measurement of the aldrin epoxidase in a biological specimen.","C154743","ALDEPX","Aldrin Epoxidase Measurement","http://id.d4k.dk/dataset/cdisc/ct/v48/sdtm/C65047-C154743"
"5243","Aldolase","A measurement of the aldolase enzyme in a biological specimen.","C74731","ALDOLASE","Aldolase Measurement","http://id.d4k.dk/dataset/cdisc/ct/v48/sdtm/C65047-C74731"
"5244","Aldosterone","A measurement of the aldosterone hormone in a biological specimen.","C74841","ALDSTRN","Aldosterone Measurement","http://id.d4k.dk/dataset/cdisc/ct/v48/sdtm/C65047-C74841"
"5245","Alfentanil","A measurement of the alfentanil in a biological specimen.","C184566","ALFNTNL","Alfentanil Measurement","http://id.d4k.dk/dataset/cdisc/ct/v48/sdtm/C65047-C184566"
"5246","Alloisoleucine","A measurement of the alloisoleucine in a biological specimen.","C154762","ALLOILE","Alloisoleucine Measurement","http://id.d4k.dk/dataset/cdisc/ct/v48/sdtm/C65047-C154762"
"5247","5-Lipoxygenase;5-LO;5-LOX;ALOX5;Arachidonate 5-Lipoxygenase","A measurement of the arachidonate 5-lipoxygenase in a biological specimen.","C184519","ALOX5","Arachidonate 5-Lipoxygenase Measurement","http://id.d4k.dk/dataset/cdisc/ct/v48/sdtm/C65047-C184519"
"5248","Alkaline Phosphatase","A measurement of the alkaline phosphatase in a biological specimen.","C64432","ALP","Alkaline Phosphatase Measurement","http://id.d4k.dk/dataset/cdisc/ct/v48/sdtm/C65047-C64432"
"5249","Alk Phos, Bone/Total Alk Phos;Alkaline Phosphatase, Bone/Total Alkaline Phosphatase","A relative measurement (ratio or percentage) of the bone specific alkaline phosphatase isoform to total alkaline phosphatase in a biological specimen.","C147294","ALPBALP","Bone Alkaline Phosphatase to Total Alkaline Phosphatase Ratio Measurement","http://id.d4k.dk/dataset/cdisc/ct/v48/sdtm/C65047-C147294"
"5250","Bone Specific Alkaline Phosphatase","A measurement of the bone specific alkaline phosphatase isoform in a biological specimen.","C92287","ALPBS","Bone Specific Alkaline Phosphatase Measurement","http://id.d4k.dk/dataset/cdisc/ct/v48/sdtm/C65047-C92287"
"5251","Alkaline Phosphatase/Creatinine","A relative measurement (ratio or percentage) of the alkaline phosphatase to creatinine in a biological specimen.","C79438","ALPCREAT","Alkaline Phosphatase to Creatinine Ratio Measurement","http://id.d4k.dk/dataset/cdisc/ct/v48/sdtm/C65047-C79438"
"5252","Alkaline Phosphatase Excretion Rate","A measurement of the amount of alkaline phosphatase being excreted in a biological specimen over a defined amount of time (e.g. one hour).","C165942","ALPEXR","Alkaline Phosphatase Excretion Rate","http://id.d4k.dk/dataset/cdisc/ct/v48/sdtm/C65047-C165942"
"5253","Alk Phos, Intestinal/Total Alk Phos;Alkaline Phosphatase, Intestinal/Total Alkaline Phosphatase","A relative measurement (ratio or percentage) of the intestinal specific alkaline phosphatase isoform to total alkaline phosphatase in a biological specimen.","C147295","ALPIALP","Intestinal Alkaline Phosphatase to Total Alkaline Phosphatase Ratio Measurement","http://id.d4k.dk/dataset/cdisc/ct/v48/sdtm/C65047-C147295"
"5254","Intestinal Specific Alkaline Phosphatase","A measurement of the intestinal specific alkaline phosphatase isoform in a biological specimen.","C119266","ALPIS","Intestinal Specific Alkaline Phosphatase Measurement","http://id.d4k.dk/dataset/cdisc/ct/v48/sdtm/C65047-C119266"
"5255","Alkaline Phosphatase Isoenzyme","A measurement of the alkaline phosphatase isoenzyme in a biological specimen.","C139091","ALPISOE","Alkaline Phosphatase Isoenzyme Measurement","http://id.d4k.dk/dataset/cdisc/ct/v48/sdtm/C65047-C139091"
"5256","Alk Phos, Liver/Total Alk Phos;Alkaline Phosphatase, Liver/Total Alkaline Phosphatase","A relative measurement (ratio or percentage) of the liver specific alkaline phosphatase isoform to total alkaline phosphatase in a biological specimen.","C147296","ALPLALP","Liver Alkaline Phosphatase to Total Alkaline Phosphatase Ratio Measurement","http://id.d4k.dk/dataset/cdisc/ct/v48/sdtm/C65047-C147296"
"5257","Liver Specific Alkaline Phosphatase","A measurement of the liver specific alkaline phosphatase isoform in a biological specimen.","C119267","ALPLS","Liver Specific Alkaline Phosphatase Measurement","http://id.d4k.dk/dataset/cdisc/ct/v48/sdtm/C65047-C119267"
"5258","Alk Phos, Placental/Total Alk Phos;Alkaline Phosphatase, Placental/Total Alkaline Phosphatase","A relative measurement (ratio or percentage) of the placental specific alkaline phosphatase isoform to total alkaline phosphatase in a biological specimen.","C184508","ALPPALP","Placental Alkaline Phosphatase to Total Alkaline Phosphatase Measurement","http://id.d4k.dk/dataset/cdisc/ct/v48/sdtm/C65047-C184508"
"5259","Placental Specific Alkaline Phosphatase","A measurement of the placental specific alkaline phosphatase isoform in a biological specimen.","C184509","ALPPS","Placental Specific Alkaline Phosphatase Measurement","http://id.d4k.dk/dataset/cdisc/ct/v48/sdtm/C65047-C184509"
"5260","Alprazolam","A measurement of the alprazolam present in a biological specimen.","C75370","ALPRZLM","Alprazolam Measurement","http://id.d4k.dk/dataset/cdisc/ct/v48/sdtm/C65047-C75370"
"5261","Acid Labile Subunit;ALS;IGFALS;Insulin Like Growth Factor Binding Protein Acid Labile Subunit","A measurement of the acid labile subunit in a biological specimen.","C163419","ALS","Acid Labile Subunit Measurement","http://id.d4k.dk/dataset/cdisc/ct/v48/sdtm/C65047-C163419"
"5262","Alanine Aminotransferase;SGPT","A measurement of the alanine aminotransferase in a biological specimen.","C64433","ALT","Alanine Aminotransferase Measurement","http://id.d4k.dk/dataset/cdisc/ct/v48/sdtm/C65047-C64433"
"5263","ALT/AST","A relative measurement (ratio or percentage) of the alanine aminotransferase (ALT) to aspartate aminotransferase (AST) present in a sample.","C106498","ALTAST","Alanine Aminotransferase to Aspartate Aminotransferase Ratio Measurement","http://id.d4k.dk/dataset/cdisc/ct/v48/sdtm/C65047-C106498"
"5264","Alpha Tocopherol","A measurement of the alpha tocopherol in a biological specimen.","C103349","ALTCPHRL","Alpha Tocopherol Measurement","http://id.d4k.dk/dataset/cdisc/ct/v48/sdtm/C65047-C103349"
"5265","Al;Aluminum","A measurement of aluminum in a biological specimen.","C111127","ALUMINUM","Aluminum Measurement","http://id.d4k.dk/dataset/cdisc/ct/v48/sdtm/C65047-C111127"
"5266","AM-2201;AM2201","A measurement of the synthetic cannabinoid AM-2201 in a biological specimen.","C184539","AM2201","AM-2201 Measurement","http://id.d4k.dk/dataset/cdisc/ct/v48/sdtm/C65047-C184539"
"5267","AM694 N-5-hydroxypentyl","A measurement of the synthetic cannabinoid metabolite AM694 N-5-hydroxypentyl in a biological specimen.","C184538","AM694N5H","AM694 N-5-hydroxypentyl Measurement","http://id.d4k.dk/dataset/cdisc/ct/v48/sdtm/C65047-C184538"
"5268","Antimitochondrial Antibodies;Mitochondrial Antibody","A measurement of the antimitochondrial antibodies in a biological specimen.","C81975","AMA","Antimitochondrial Antibody Measurement","http://id.d4k.dk/dataset/cdisc/ct/v48/sdtm/C65047-C81975"
"5269","ACH Receptor Modulation Antibody/ACH Receptor Antibody;ACH Receptor Modulatn Ab/ACH Receptor Ab","A relative measurement (ratio or percentage) of the acetylcholine receptor modulation antibody to the total acetylcholine receptor antibodies in a biological specimen.","C147297","AMABARAB","Acetylcholine Receptor Modulation Antibody to Acetylcholine Receptor Antibody Ratio Measurement","http://id.d4k.dk/dataset/cdisc/ct/v48/sdtm/C65047-C147297"
"5270","Alpha-Methylacyl Coenzyme A Racemase","A measurement of the alpha-methylacyl coenzyme A racemase in a biological specimen.","C132364","AMACR","Alpha-Methylacyl Coenzyme A Racemase Measurement","http://id.d4k.dk/dataset/cdisc/ct/v48/sdtm/C65047-C132364"
"5271","Amobarbital","A measurement of the amobarbital present in a biological specimen.","C75363","AMBRBTL","Amobarbital Measurement","http://id.d4k.dk/dataset/cdisc/ct/v48/sdtm/C65047-C75363"
"5272","AMACR mRNA","A measurement of the alpha-methylacyl coenzyme A racemase mRNA in a biological specimen.","C132365","AMCRMRNA","Alpha-Methylacyl Coenzyme A Racemase mRNA Measurement","http://id.d4k.dk/dataset/cdisc/ct/v48/sdtm/C65047-C132365"
"5273","Anti-Mullerian Hormone","A measurement of the anti-Mullerian hormone in a biological specimen.","C120625","AMH","Anti-Mullerian Hormone Measurement","http://id.d4k.dk/dataset/cdisc/ct/v48/sdtm/C65047-C120625"
"5274","Ammonia;NH3","A measurement of the ammonia in a biological specimen.","C74799","AMMONIA","Ammonia Measurement","http://id.d4k.dk/dataset/cdisc/ct/v48/sdtm/C65047-C74799"
"5275","AA;Amino Acids","A measurement of the total amino acids in a biological specimen.","C81183","AMNOACID","Amino Acid Measurement","http://id.d4k.dk/dataset/cdisc/ct/v48/sdtm/C65047-C81183"
"5276","Amorphous Debris;Amorphous Sediment","A measurement of the amorphous sediment present in a biological specimen.","C74666","AMORPHSD","Amorphous Sediment Measurement","http://id.d4k.dk/dataset/cdisc/ct/v48/sdtm/C65047-C74666"
"5277","Alpha-Methylphenethylamine;Amphetamine","A measurement of the alpha-methylphenethylamine in a biological specimen.","C75347","AMPEA","Amphetamine Measurement","http://id.d4k.dk/dataset/cdisc/ct/v48/sdtm/C65047-C75347"
"5278","Amphetamine","A measurement of any amphetamine class drug present in a biological specimen.","C74687","AMPHET","Amphetamine Drug Class Measurement","http://id.d4k.dk/dataset/cdisc/ct/v48/sdtm/C65047-C74687"
"5279","d-amphetamine;Dextroamphetamine","A measurement of the dextroamphetamine in a biological specimen.","C102262","AMPHETD","Dextroamphetamine Measurement","http://id.d4k.dk/dataset/cdisc/ct/v48/sdtm/C65047-C102262"
"5280","Amylase","A measurement of the total enzyme amylase in a biological specimen.","C64434","AMYLASE","Amylase Measurement","http://id.d4k.dk/dataset/cdisc/ct/v48/sdtm/C65047-C64434"
"5281","Macroamylase","A measurement of macroamylase in a biological specimen.","C111243","AMYLASEM","Macroamylase Measurement","http://id.d4k.dk/dataset/cdisc/ct/v48/sdtm/C65047-C111243"
"5282","Amylase, Pancreatic;Pancreatic Amylase Isoenzyme","A measurement of the pancreatic enzyme amylase in a biological specimen.","C98767","AMYLASEP","Pancreatic Amylase Measurement","http://id.d4k.dk/dataset/cdisc/ct/v48/sdtm/C65047-C98767"
"5283","Amylase, Salivary;Salivary Amylase Isoenzyme","A measurement of the salivary enzyme amylase in a biological specimen.","C98780","AMYLASES","Salivary Amylase Measurement","http://id.d4k.dk/dataset/cdisc/ct/v48/sdtm/C65047-C98780"
